Symbol,Name,LastSale,NetChange,NetChangeDirection,PercentChange,1YrPercentChange
PHDG,Invesco S&P 500 Downside Hedged ETF,27.6932,0.17,up,0.62,-7.46
PHO,Invesco Water Resources ETF,33.36,0.25,up,0.76,9.49
PHYL,PGIM Active High Yield Bond ETF,40.0749,0.0799,up,0.2,-0.9
PHYS,Sprott Physical Gold Trust ETV,10.72,0,unch,0,-0.46
PICB,Invesco International Corporate Bond ETF,25.9,0.1,up,0.39,-7.06
PICK,"iShares, Inc.",31.01,0.5,up,1.64,-14.92
PID,Invesco International Dividend Achievers ETF,15.9474,0.1474,up,0.93,-2.59
PIE,Invesco DWA Emerging Markets Momentum ETF,16.85,0.24,up,1.44,-21.5
PILL,Direxion Daily Pharmaceutical & Medical Bull 3X Shares,25.27,0.4967,up,2,-13.15
PIN,Invesco India ETF,23.54,0.25,up,1.07,-9.41
PIO,Invesco Global Water ETF,26.18,0.15,up,0.58,2.12
PIZ,Invesco DWA Developed Markets Momentum ETF,25.44,0.06,up,0.24,-10.54
PJAN,Innovator ETFs Trust,26.7709,0.0921,up,0.35,5.54
PJP,Invesco Dynamic Pharmaceuticals ETF,66.36,0.56,up,0.85,0.21
PJUL,Innovator ETFs Trust,25.26,0.101,up,0.4,0.24
PKB,Invesco Dynamic Building & Construction ETF,28.17,0.31,up,1.11,-13.83
PKW,Invesco BuyBack Achievers ETF,60.09,0.33,up,0.55,0.27
PLCY,Active Weighting Funds,21.7618,0.1038,up,0.48,2.85
PLND,VanEck Vectors Poland ETF,16.8988,0.0168,up,0.1,-13.66
PLTM,GraniteShares Platinum Shares ETF,83.9133,1.9982,up,2.44,-18.3
PLW,Invesco 1-30 Laddered Treasury ETF,32.04,0.16,up,0.5,2.74
PMOM,Principal Sustainable Momentum Index ETF,27.6289,0.1789,up,0.65,5.78
PMR,Invesco Dynamic Retail ETF,37.1139,0.2156,up,0.58,0.46
PNQI,Invesco Nasdaq Internet ETF,130.65,1.97,up,1.53,-0.86
PPA,Invesco Aerospace & Defense ETF,59.64,0.5,up,0.85,2.48
PPDM,PortfolioPlus Developed Markets ETF,22.3267,0.1516,up,0.68,-12.04
PPEM,PortfolioPlus Emerging Markets ETF,21.1148,0.2935,up,1.41,-17.51
PPH,VanEck Vectors Pharmaceutical ETF,60.48,0.62,up,1.04,0.3
PPLC,PortfolioPlus S&P 500 ETF,37.5144,0.2744,up,0.74,0.98
PPLN,J P Morgan Chase & Co,17.3313,0.0728,up,0.42,-9.11
PPLT,Aberdeen Standard Physical Platinum Shares ETF,79.9,1.91,up,2.45,-17.23
PPMC,PortfolioPlus S&P Mid Cap ETF,25.7149,0.206,up,0.81,0.87
PPSC,PortfolioPlus S&P Small Cap ETF,37.3914,0.2076,up,0.56,4.23
PPTY,PPTY U.S. Diversified Real Estate ETF,29.6777,0.1763,up,0.6,16.7
PQIN,PGIM QMA Strategic Alpha International Equity ETF,51.834,0.1822,up,0.35,6.69
PQLC,PGIM QMA Strategic Alpha Large-Cap Core ETF,50.9375,0.2264,up,0.45,2.69
PQSG,PGIM QMA Strategic Alpha Small-Cap Growth ETF,52.4288,0.4931,up,0.95,4.11
PQSV,PGIM ETF Trust ETF PGIM QMA Strategic Alpha Small-Cap Value ET,51.3042,0.319,up,0.63,2.67
PRB,VanEck Vectors Pre-Refunded Municipal Index ETF,24.53,0.01,up,0.04,0.91
PREF,Principal Exchange-Traded Funds,94.15,0.3303,up,0.35,-4.99
PRF,Invesco FTSE RAFI US 1000 ETF,113.71,0.56,up,0.49,0.58
PRFZ,Invesco FTSE RAFI US 1500 Small-Mid ETF,133.3,0.95,up,0.72,2.3
PRID,InsightShares LGBT Employment Equality ETF,25.7214,0.1661,up,0.65,3.5
PRME,First Trust Heitman Global Prime Real Estate ETF,20.365,0.19,up,0.94,6.75
PRN,Invesco DWA Industrials Momentum ETF,60,0.77,up,1.3,-4.71
PRNT,ARK ETF Trust,23.65,0.1079,up,0.46,-3.13
PSC,Principal U.S. Small-Cap Multi-Factor Index ETF,32.236,0.2061,up,0.64,2.69
PSCC,Invesco S&P SmallCap Consumer Staples ETF,78.65,0.6,up,0.77,9.28
PSCD,Invesco S&P SmallCap Consumer Discretionary ETF,61.79,-1.019,down,1.62,4.95
PSCE,Invesco S&P SmallCap Energy ETF,10.89,0.0601,up,0.55,-24.32
PSCF,Invesco S&P SmallCap Financials ETF,55.38,0.21,up,0.38,2.57
PSCH,Invesco S&P SmallCap Health Care ETF,122.87,0.7,up,0.57,13.89
PSCI,Invesco S&P SmallCap Industrials ETF,66.6,0.039,up,0.06,3.19
PSCM,Invesco S&P SmallCap Materials ETF,51.2499,0.3565,up,0.7,-3.43
PSCT,Invesco S&P SmallCap Information Technology ETF,83.81,0.93,up,1.12,7.09
PSCU,Invesco S&P SmallCap Utilities & Communication Services ETF,54.19,0.8,up,1.5,9.2
PSET,Principal Price Setters Index ETF,35.18,0.23,up,0.66,6.23
PSI,Invesco Dynamic Semiconductors ETF,53.61,0.53,up,1,1.41
PSJ,Invesco Dynamic Software ETF,87.99,1.73,up,2.01,24.2
PSK,SPDR Wells Fargo Preferred Stock ETF,42.25,0.06,up,0.14,-1.06
PSL,Invesco DWA Consumer Staples Momentum ETF,70,0.3699,up,0.53,6.37
PSLV,Sprott Physical Silver Trust ETV,5.8,0.04,up,0.69,-5.42
PSMB,Invesco Actively Managed Exchange-Traded Fund Trus,13.565,0.0697,up,0.52,0.78
PSMC,Invesco Actively Managed Exchange-Traded Fund Trus,12.7512,0.0161,up,0.13,-0.16
PSMG,Invesco Actively Managed Exchange-Traded Fund Trus,14.0699,0.0948,up,0.68,0.83
PSMM,Invesco Actively Managed Exchange-Traded Fund Trus,13.225,0.0498,up,0.38,0.5
PSP,Invesco Global Listed Private Equity ETF,11.4,0.08,up,0.71,-10.87
PSQ,ProShares Short QQQ,30.68,-0.23,down,0.74,-7.65
PSR,Invesco Active U.S. Real Estate Fund,86.2466,0.4683,up,0.55,16.37
PST,ProShares UltraShort Lehman 7-10 Year Treasury,21.68,-0.1,down,0.46,-6.76
PTEU,Pacer Funds,25.13,0.02,up,0.08,-18.27
PTF,Invesco DWA Technology Momentum ETF,64.28,1.1949,up,1.89,11.44
PTH,Invesco DWA Healthcare Momentum ETF,82.16,0.88,up,1.08,4.22
PTLC,Pacer Funds,28.91,0.16,up,0.56,-0.79
PTMC,Pacer Funds,30.92,0.02,up,0.06,-0.06
PTNQ,Pacer Funds,32.74,0.01,up,0.03,2.51
PUI,Invesco DWA Utilities Momentum ETF,31.67,0.263,up,0.84,23.37
PULS,PGIM Ultra Short Bond ETF,50.09,0.01,up,0.02,0.15
PUTW,WisdomTree CBOE S&P 500 PutWrite Strategy Fund,26.615,0.055,up,0.21,-6.84
PVAL,Principal Contrarian Value Index ETF,25.94,0.15,up,0.58,0
PVI,Invesco VRDO Tax Free Weekly ETF,24.905,-0.02,down,0.08,0.22
PWB,Invesco Dynamic Large Cap Growth ETF,47.08,0.41,up,0.88,7.78
PWC,Invesco Dynamic Market ETF,98.4337,0.3432,up,0.35,-0.43
PWS,Pacer Funds,24.215,0.125,up,0.52,-6.56
PWV,Invesco Dynamic Large Cap Value ETF,36.37,0.2,up,0.55,-4.03
PWZ,Invesco California AMT-Free Municipal Bond Portfolio,25.84,0.045,up,0.17,0.76
PXE,Invesco Dynamic Energy Exploration &Production ETF,19.45,0.09,up,0.46,-4.63
PXF,Invesco FTSE RAFI Developed Markets ex-U.S. ETF,40.84,0.15,up,0.37,-10.28
PXH,Invesco FTSE RAFI Emerging Markets ETF,21.72,0.22,up,1.02,-10.08
PXI,Invesco DWA Energy Momentum ETF,32.53,0.25,up,0.77,-12.57
PXJ,Invesco Dynamic Oil & Gas Services ETF,7.2,0,unch,0,-16.96
PXLG,Invesco Russell Top 200 Pure Growth ETF,52.4,0.52,up,1,7.9
PXLV,Invesco Russell Top 200 Pure Value ETF,38.4426,0.0687,up,0.18,-0.65
PXMG,Invesco Russell MidCap Pure Growth ETF,55.46,0.92,up,1.69,20.98
PXMV,Invesco Russell Midcap Pure Value ETF,31.53,0.1957,up,0.62,2.79
PXQ,Invesco Dynamic Networking ETF,57.6523,0.6725,up,1.18,15.67
PXSG,Invesco Russell 2000 Pure Growth ETF,37.13,0.35,up,0.95,12.31
PXSV,Invesco Russell 2000 Pure Value ETF,30.74,0.21,up,0.69,4.2
PXUS,Principal International Multi-Factor Index ETF,90.695,0,unch,0,2.51
PY,Principal Shareholder Yield Index ETF,31.95,0.2287,up,0.72,0
PYPE,UBS AG,22.6316,0.0623,up,0.28,-9.97
PYZ,Invesco DWA Basic Materials Momentum ETF,61.85,0.1,up,0.16,-10.27
PZA,Invesco National AMT-Free Municipal Bond ETFo,25.15,0.04,up,0.16,0.56
PZD,Invesco Cleantech ETF,42.724,0.2148,up,0.51,-3.01
PZT,Invesco New York AMT-Free Municipal Bond ETF,24.0422,0.0222,up,0.09,0.33
QABA,First Trust NASDAQ ABA Community Bank Index Fund,51.025,0.095,up,0.19,-6.52
QAI,IQ Hedge MultiIQ Hedge Multi-Strategy Tracker ETF,29.95,0.1,up,0.34,-2.36
QARP,Xtrackers Russell 1000 US QARP ETF,26.4,0.22,up,0.84,4.26
QAT,iShares MSCI Qatar ETF,18.36,0.17,up,0.93,9.45
QCLN,First Trust NASDAQ Clean Edge Green Energy Index Fund,20.85,0.4101,up,2.01,0.79
QDEF,FlexShares Quality Dividend Defensive Index Fund,44.0464,0.2964,up,0.68,0.14
QDF,FlexShares Quality Dividend Index Fund,44.6,0.37,up,0.84,-0.74
QDIV,Global X Funds,24.9491,0.1381,up,0.56,-0.48
QDYN,FlexShares Quality Dynamic Index Fund,43.5298,0.3934,up,0.91,-3.12
QED,IQ Hedge Event-Driven Tracker ETF,20.8698,0.0898,up,0.43,-0.1
QEFA,SPDR MSCI EAFE StrategicFactors ETF,61.2732,0.2611,up,0.43,-5.92
QEMM,SPDR MSCI Emerging Markets StrategicFactors ETF,59.352,0.6169,up,1.05,-11.02
QGRO,American Century STOXX U.S. Quality Growth ETF,39.4861,0.5028,up,1.29,-3.2
QGTA,IQ Leaders GTAA Tracker ETF,23.5863,0.0891,up,0.38,-4.28
QID,ProShares UltraShort QQQ,37.37,-0.61,down,1.61,-19.33
QINT,American Century Quality Diversified International ETF,37.9906,0.1919,up,0.51,-5.81
QLC,FlexShares US Quality Large Cap Index Fund,33.91,0.32,up,0.95,-0.74
QLD,ProShares Ultra QQQ,83.4,1.25,up,1.52,1.23
QLS,IQ Hedge Long Short Tracker ETF,20.8198,0.07,up,0.34,-6.28
QLTA,iShares Aaa A Rated Corporate Bond ETF,51.2153,0.1152,up,0.23,0.2
QMN,IQ Hedge Market Neutral Tracker ETF,25.83,0.055,up,0.21,0.21
QMOM,ValueShares U.S. Quantitative Value ETF,29.66,0.4225,up,1.45,-2.32
QQEW,First Trust NASDAQ-100 Equal Weighted Index Fund,63.15,0.39,up,0.62,4.88
QQQ,"Invesco QQQ Trust, Series 1",172.89,1.27,up,0.74,4.13
QQQE,Direxion NASDAQ-100 Equal Weighted Index Shares,47.0345,0.2245,up,0.48,4.91
QQXT,First Trust NASDAQ-100 Ex-Technology Sector Index Fund,51.8272,0.0872,up,0.17,3.79
QSY,WisdomTree U.S. Quality Shareholder Yield Fund,86.1997,0.5363,up,0.63,2.75
QTEC,First Trust NASDAQ-100- Technology Index Fund,80.62,1.07,up,1.35,4.55
QTUM,Defiance Quantum ETF,23.9433,0.2839,up,1.2,-4.4
QUAL,iShares Trust,86.75,0.84,up,0.98,2.84
QUS,SPDR MSCI USA StrategicFactors ETF,81.45,0.56,up,0.69,4.17
QVAL,ValueShares U.S. Quantitative Value ETF,29.6929,0.2629,up,0.89,-5.96
QVM,Arrow QVM Equity Factor ETF,27.2698,0.2302,up,0.85,-4.49
QWLD,SPDR MSCI World StrategicFactors ETF,75.8582,0.4443,up,0.59,-0.5
QXGG,Northern Lights Fund Trust IV,28.2621,0.0971,up,0.34,0.57
QXTR,Northern Lights Fund Trust IV,24.433,0.0721,up,0.3,-4.79
QYLD,Global X NASDAQ-100 Covered Call ETF,22.315,0.095,up,0.43,-10.48
RAAX,VanEck Vectors Real Asset Allocation ETF,25.0201,0.0141,up,0.06,-2.21
RALS,ProShares RAFI Long Short ETF,35.756,0.0495,up,0.14,-2.86
RAVI,FlexShares Ready Access Variable Income Fund,75.44,0,unch,0,0.05
RBIN,Nationwide Risk-Based International Equity ETF,24.62,0.1,up,0.41,-6.7
RBUS,Nationwide Risk-Based U.S. Equity ETF,27.0221,0.0919,up,0.34,2.86
RCD,Invesco S&P 500 Equal Weight Consumer Discretionary ETF,103.48,0.5072,up,0.49,0.66
RDIV,Oppenheimer S&P Ultra Dividend Revenue ETF,37.77,-0.23,down,0.61,7.99
RDVY,First Trust Rising Dividend Achievers ETF,30.3,0.18,up,0.6,-1.95
REDV,Oppenheimer Emerging Markets Ultra Dividend Revenue ETF,24.7322,0.3118,up,1.28,2.3
REEM,Oppenheimer Revenue Weighted ETF Trust,25.7324,0.3096,up,1.22,-10.92
REET,iShares Trust iShares Global REIT ETF,26.36,0.17,up,0.65,9.4
REFA,Oppenheimer Revenue Weighted ETF Trust,24.8582,0.0698,up,0.28,-11.31
REGL,ProShares Trust,57.67,0.21,up,0.37,9.01
REK,ProShares Short Real Estate,14.59,-0.0771,down,0.53,-16.46
REM,iShares Trust,43.31,0.27,up,0.63,3.59
REML,Credit Suisse AG,24.57,0.27,up,1.11,0.5
REMX,VanEck Vectors Rare Earth Strategic Metals ETF,15.49,0.28,up,1.84,-48.44
RETL,Direxion Daily Retail Bull 3X Shares ETF,30.24,0.37,up,1.24,-15.55
REW,ProShares UltraShort Technology,10.91,-0.3,down,2.68,-22.1
REZ,iShares Trust iShares Residential Real Estate ETF,68.99,0.28,up,0.41,25.87
RFAP,First Trust RiverFront Dynamic Asia Pacific ETF,52.02,0.23,up,0.44,-15.03
RFCI,RiverFront Dynamic Core Income ETF,24.07,0.065,up,0.27,-0.35
RFDA,RiverFront Dynamic US Dividend Advantage ETF,31.7434,0.2432,up,0.77,-1.32
RFDI,First Trust RiverFront Dynamic Developed International ETF,56.635,0.245,up,0.43,-12.94
RFEM,First Trust RiverFront Dynamic Emerging Markets ETF,63.021,0.9703,up,1.56,-17.56
RFEU,First Trust RiverFront Dynamic Europe ETF,58.2904,0.2604,up,0.45,-12.22
RFFC,RiverFront Dynamic US Flex-Cap ETF,33,0.1025,up,0.31,0.21
RFG,Invesco S&P Midcap 400 Pure Growth ETF,154.53,2.1584,up,1.42,-4.64
RFUN,RiverFront Dynamic Unconstrained Income ETF,24.915,0.025,up,0.1,-1.89
RFV,Invesco S&P Midcap 400 Pure Value ETF,69.5601,0.4461,up,0.65,1.65
RGI,Invesco S&P 500 Equal Weight Industrials Portfolio,121.3801,0.7174,up,0.59,-1.35
RGLB,Oppenheimer Revenue Weighted ETF Trust,26.0576,0.1438,up,0.55,-7.56
RHS,Invesco S&P 500 Equal Weight Consumer Staples ETF,126.6,-1.3,down,1.02,-0.81
RIDV,Oppenheimer International Ultra Dividend Revenue ETF,23.5081,0.1191,up,0.51,-7.18
RIGS,RiverFront Strategic Income Fund,24.57,0.13,up,0.53,-0.65
RINF,ProShares Inflation Expectations ETF,27.8594,0.1557,up,0.56,-3.71
RING,iShares MSCI Global Gold Miners ETF,18.15,-0.04,down,0.22,2.83
RISE,Sit Rising Rate ETF,24.1043,0.0043,up,0.02,-2.43
RJA,AB Svensk Ekportkredit (Swedish Export Credit Corporation),5.655,-0.005,down,0.09,-8.71
RJI,AB Svensk Ekportkredit (Swedish Export Credit Corporation),5.33,0.01,up,0.19,-2.56
RJN,AB Svensk Ekportkredit (Swedish Export Credit Corporation),2.945,0.005,up,0.17,4.63
RJZ,AB Svensk Ekportkredit (Swedish Export Credit Corporation),8.205,0.07,up,0.86,-8.8
RLY,SPDR SSgA Multi Asset Real Return ETF,25.17,0.1854,up,0.74,-3.64
RNDM,First Trust Developed International Equity Select ETF,49.225,0.235,up,0.48,-5.52
RNDV,First Trust US Equity Dividend Select ETF,21.62,0,unch,0,-0.96
RNEM,First Trust Emerging Markets Equity Select ETF,51.6364,0.3874,up,0.76,-9.34
RNLC,First Trust Large Cap US Equity Select ETF,21.9775,0.0545,up,0.25,0.37
RNMC,First Trust Mid Cap US Equity Select ETF,21.906,0.0997,up,0.46,1.75
RNSC,First Trust Small Cap US Equity Select ETF,21.8,0.03,up,0.14,3.08
ROAM,Hartford Multifactor Emerging Markets ETF,24.05,0.28,up,1.18,-11.57
ROBO,Exchange Traded Concepts Trust ROBO Global Robotics and Automa,38.8,0.17,up,0.44,-9.43
ROBT,First Trust Nasdaq Artificial Intelligence and Robotics ETF,31.46,0.47,up,1.52,3.27
RODI,Barclays PLC,70,0,unch,0,0
RODM,Hartford Multifactor Developed Markets (ex-US) ETF,28,0.1,up,0.36,-5.36
ROGS,Hartford Multifactor Global Small Cap ETF,30.3454,0.1459,up,0.48,-5
ROM,ProShares Ultra Technology,102.1959,2.6716,up,2.68,3.15
ROOF,IQ US Real Estate Small Cap ETF,25.23,0.1269,up,0.51,8.8
RORE,Hartford Multifactor REIT ETF,15.818,0.1459,up,0.93,14.38
ROUS,Hartford Multifactor U.S. Equity ETF,31.53,0.1958,up,0.62,-1.14
RPG,Invesco S&P 500 Pure Growth ETF,113.72,0.82,up,0.73,2.08
RPUT,WisdomTree Trust,18.8367,0.0765,up,0.41,-23.37
RPV,Invesco S&P 500 Pure Value ETF,65.09,0.09,up,0.14,-1.72
RSP,Invesco S&P 500 Equal Weight ETF,104.53,0.55,up,0.53,3.03
RSX,VanEck Vectors Russia ETF,20.73,0.19,up,0.93,-11.58
RSXJ,VanEck Vectors Russia Small-Cap ETF,31.05,0.11,up,0.36,-26.35
RTH,VanEck Vectors Retail ETF,102.39,0.46,up,0.45,4.48
RTL,Pacer Benchmark Retail Real Estate SCTR ETF,28.3302,0.1568,up,0.56,15.21
RTM,Invesco S&P 500 Equal Weight Materials ETF,106.6783,0.2683,up,0.25,-4.26
RUSL,Direxion Daily Russia Bull 3x Shares,39.21,0.94,up,2.46,-40.59
RUSS,Direxion Daily Russia Bear 3x Shares,14.9,-0.44,down,2.87,-7.98
RVNU,Xtrackers Municipal Infrastructure Revenue Bond ETF,26.57,0.08,up,0.3,1.34
RVRS,ETF Series Solutions,16.5111,0.0865,up,0.53,3.63
RWCD,Direxion MSCI Cyclicals Over Defensives ETF,54.7,0.4245,up,0.78,7.5
RWDC,Direxion MSCI Defensives Over Cyclicals ETF,51.9343,0.2126,up,0.41,3.79
RWDE,Direxion MSCI Developed Over Emerging Markets ETF,52.3872,0.0323,up,0.06,4.88
RWED,Direxion MSCI Emerging Over Developed Markets ETF,52.8297,0.7574,up,1.45,2.42
RWGV,Direxion Russell 1000 Growth Over Value ETF,54.0887,0.64,up,1.2,5.01
RWIU,Direxion FTSE Russell International Over US ETF,51.9962,0.2612,up,0.5,1.03
RWJ,Oppenheimer S&P SmallCap 600 Revenue ETF,69.99,0.36,up,0.52,0.75
RWK,Oppenheimer S&P MidCap 400 Revenue ETF,61.24,0.515,up,0.85,1.39
RWL,Oppenheimer S&P 500 Revenue ETF,52.18,0.22,up,0.42,1.48
RWLS,Direxion Russell Large Over Small Cap ETF,53.1054,0.292,up,0.55,5.3
RWM,ProShares Short Russell2000,39.59,-0.35,down,0.88,-5.4
RWO,SPDR DJ Wilshire Global Real Estate ETF,49.26,0.33,up,0.67,8.73
RWR,SPDR DJ Wilshire REIT ETF,97.95,0.67,up,0.69,17.37
RWSL,Direxion Russell Small Over Large Cap ETF,55.7277,0.52,up,0.94,9.39
RWUI,Direxion FTSE Russell US Over International ETF,54.3312,0.3325,up,0.62,7.25
RWVG,Direxion Russell 1000 Value Over Growth ETF,53.3627,0.0626,up,0.12,5.54
RWW,Oppenheimer S&P Financials Revenue ETF,64.4271,-0.1823,down,0.28,-8.26
RWX,SPDR DJ Wilshire Intl Real Estate,38.35,0.12,up,0.31,-2.94
RXD,ProShares UltraShort Health Care,21.9573,-0.4519,down,2.02,-21.2
RXI,iShares Global Consumer Discretionary ETF,111.4082,0.6982,up,0.63,-3.49
RXL,ProShares Ultra Health Care,105.8564,2.0664,up,1.99,13.59
RYE,Invesco S&P 500 Equal Weight Energy ETF,50.3566,0.1166,up,0.23,-5.14
RYF,Invesco S&P 500 Equal Weight Financial ETF,41.88,0.16,up,0.38,-7.88
RYH,Invesco S&P 500 Equal Weight Health Care ETF,199.0997,1.5805,up,0.8,7.31
RYJ,Invesco Raymond James SB-1 Equity ETF,43.6127,0.4869,up,1.13,-0.96
RYT,Invesco S&P 500 Equal Weight Technology ETF,167,2.19,up,1.33,8.3
RYU,Invesco S&P 500 Equal Weight Utilities ETF,94.91,0.49,up,0.52,17.12
RZG,Invesco S&P Smallcap 600 Pure Growth ETF,119.52,0.6,up,0.5,4.39
RZV,Invesco S&P Smallcap 600 Pure Value ETF,71.3156,0.6031,up,0.85,0.16
SAA,ProShares Ultra SmallCap600,105.1338,0.8053,up,0.77,4.98
SAGG,Direxion Daily Total Bond Market Bear 1X Shares,31.4,-0.085,down,0.27,-1.52
SBB,ProShares Short SmallCap600,31.6946,-0.1209,down,0.38,-6.27
SBIO,ALPS Medical Breakthroughs ETF,33.81,0.74,up,2.24,-6.98
SBM,Short Basic Materials,18.5947,-0.102,down,0.55,7.53
SCAP,AdvisorShares Cornerstone Small Cap ETF,37.4315,0.3711,up,1,6.71
SCC,ProShares UltraShort Consumer Services,17.3486,-0.2156,down,1.23,-22.95
SCHA,Schwab U.S. Small-Cap ETF,71.99,0.64,up,0.9,2.63
SCHB,Schwab U.S. Broad Market ETF,67.51,0.46,up,0.69,2.82
SCHC,Schwab International Small-Cap Equity ETF,32.3,0.2,up,0.62,-12.84
SCHD,Schwab US Dividend Equity ETF,52.09,0.37,up,0.72,3.34
SCHE,Schwab Emerging Markets Equity ETF,25.79,0.3,up,1.18,-13.03
SCHF,Schwab International Equity ETF,31.11,0.14,up,0.45,-8.8
SCHG,Schwab U.S. Large-Cap Growth ETF,77.73,0.64,up,0.83,5.27
SCHH,Schwab U.S. REIT ETF,43.82,0.27,up,0.62,18.18
SCHK,Schwab 1000 Index ETF,27.53,0.18,up,0.66,3.09
SCHM,Schwab U.S. Mid Cap ETF,55.81,0.48,up,0.87,4.04
SCHO,Schwab Short-Term U.S. Treasury ETF,49.96,0.03,up,0.06,0.32
SCHP,Schwab U.S. TIPs ETF,54.13,0.15,up,0.28,-0.31
SCHR,Schwab Intermediate-Term U.S. Treasury ETF,53.06,0.12,up,0.23,1.59
SCHV,Schwab U.S. Large-Cap Value ETF,54.76,0.24,up,0.44,0.65
SCHX,Schwab U.S. Large-Cap ETF,66.84,0.43,up,0.65,2.88
SCHZ,Schwab US Aggregate Bond ETF,51.09,0.09,up,0.18,0.63
SCID,Global X Scientific Beta Europe ETF,23.9685,0.0827,up,0.35,-16.12
SCIF,VanEck Vectors India Small-Cap Index ETF,38.13,0.64,up,1.71,-38.57
SCIJ,Global X Scientific Beta Japan ETF,27.3202,0.0107,up,0.04,-14.15
SCIN,Columbia India Small Cap ETF,12.9449,0.1046,up,0.81,-39.66
SCIU,Global X Scientific Beta US ETF,31.42,0.1359,up,0.43,0.39
SCIX,Global X Scientific Beta Asia ex-Japan ETF,24.4095,0.1803,up,0.74,-7.27
SCJ,iShares MSCI Japan Sm Cap,70.34,0.17,up,0.24,-12.92
SCO,ProShares UltraShort Bloomberg Crude Oil,18.6,-0.2,down,1.06,-18.54
SCOM,ProShares UltraPro Short Communication Services Select Sector,35.7037,-1.0625,down,2.89,-9.08
SCTO,Global X JPMorgan US Sector Rotator Index ETF,23.6285,0.092,up,0.39,-12.75
SCZ,iShares MSCI EAFE Small-Cap ETF,56.94,0.24,up,0.42,-13.29
SDAG,IQ Short Duration Enhanced Core Bond U.S. ETF,25.16,0.025,up,0.1,0.46
SDCI,USCF SummerHaven Dynamic Commodity Strategy No K-1 Fund,19.8322,0.0889,up,0.45,-10.39
SDD,ProShares UltraShort SmallCap600,12.8238,-0.1008,down,0.78,-16.02
SDEM,Global X MSCI SuperDividend Emerging Markets ETF,14.4349,0.2376,up,1.67,-17.68
SDG,iShares MSCI Global Impact ETF,58.3174,0.3722,up,0.64,-3.15
SDGA,Impact Shares Sustainable Development Goals Global Equity ETF,20.0175,0.1187,up,0.6,-0.8
SDIV,Global X SuperDividend ETF,18.9,0.19,up,1.02,-10.56
SDOG,ALPS Sector Dividend Dogs ETF,43.39,0.04,up,0.09,-4.3
SDOW,UltraPro Short Dow30,13.55,-0.27,down,1.95,-25.82
SDP,ProShares UltraShort Utilities,19.59,-0.1933,down,0.98,-32.23
SDS,ProShares UltraShort S&P500,34.41,-0.43,down,1.23,-12.24
SDVY,First Trust SMID Cap Rising Dividend Achievers ETF,20.76,0.03,up,0.14,-2.9
SDY,SPDR S&P Dividend ETF,99.63,0.5,up,0.5,8.1
SDYL,ETRACS 2X Wells Fargo - BDCI,89.0719,0.7909,up,0.9,9.01
SEA,Invesco Shipping ETF,9.12,0.075,up,0.83,-19.02
SECT,Northern Lights Fund Trust IV,27.5046,0.211,up,0.77,-4.18
SEF,ProShares Short Financials,22.6,-0.0309,down,0.14,-0.66
SFHY,WisdomTree Trust,50.1351,0.0537,up,0.11,2.35
SFIG,WisdomTree Trust,49.515,0.045,up,0.09,0.98
SGDJ,ALPS ETF Trust Sprott Junior Gold Miners ETF,29.14,0.16,up,0.55,-2.06
SGDM,Sprott Gold Miners ETF,19.8,0.07,up,0.35,1.86
SGG,Barclays PLC,46.355,0.4514,up,0.98,5.07
SGOL,Aberdeen Standard Physical Swiss Gold Shares ETF,128.05,0.41,up,0.32,-0.82
SH,ProShares Short S&P500,28.16,-0.15,down,0.53,0
SHAG,WisdomTree Trust,49.225,0.055,up,0.11,0.18
SHE,SPDR Series Trust SPDR SSGA Gender Diversity Index ETF,70.764,0.414,up,0.59,-0.68
SHM,SPDR Nuveen Bloomberg Barclays Short Term Municipal Bond ETF,48.36,0.01,up,0.02,0.81
SHV,iShares Short Treasury Bond ETF,110.51,0,unch,0,0.21
SHY,iShares 1-3 Year Treasury Bond ETF,83.76,0.06,up,0.07,0.31
SHYD,VanEck Vectors Short High-Yield Municipal Index ETF,24.4,-0.04,down,0.16,1.03
SHYG,iShares 0-5 Year High Yield Corporate Bond ETF,46.5,0.08,up,0.17,-0.71
SHYL,Xtrackers Short Duration High Yield Bond ETF,49.07,0.03,up,0.06,-1.13
SIJ,ProShares UltraShort Industrials,14.1845,-0.2148,down,1.49,-10.01
SIL,Global X Silver Miners ETF,27.65,0.2,up,0.73,-9.35
SILJ,ETFMG Prime Junior Silver ETF,9.47,0.05,up,0.53,-11.38
SIVR,Aberdeen Standard Physical Silver Shares ETF,15.48,0.11,up,0.72,-4.42
SIZ,AGFiQ U.S. Market Neutral Size Fund,19.4308,0.0438,up,0.23,0.73
SIZE,iShares Edge MSCI USA Size Factor ETF,88.01,0.62,up,0.71,3.43
SJB,ProShares Short High Yield,22.28,0,unch,0,-4.79
SJNK,SPDR Bloomberg Barclays Short Term High Yield Bond ETF,27.1,0.01,up,0.04,-1.17
SKF,ProShares UltraShort Financials,19.23,-0.03,down,0.16,-4.51
SKOR,FlexShares Credit-Scored US Corporate Bond Index Fund,49.86,0.1199,up,0.24,0.48
SKYY,First Trust Cloud Computing ETF,56.53,0.67,up,1.2,15.86
SLIM,The Obesity ETF,34.795,0.3457,up,1,6.33
SLQD,iShares 0-5 Year Investment Grade Corporate Bond ETF,50.09,0.08,up,0.16,0.56
SLT,ETF Series Solutions,25.3839,0.3499,up,1.4,-0.64
SLV,iShares Silver Trust,14.95,0.12,up,0.81,-4.57
SLVO,Credit Suisse AG,7.06,0.08,up,1.15,-9
SLVP,"iShares, Inc.",9.61,0.16,up,1.69,-5.5
SLX,VanEck Vectors Steel ETF,40.74,0.57,up,1.42,-19.6
SLY,SPDR S&P 600 Small Cap ETF (based on S&P SmallCap 600 Index --,70.15,0.34,up,0.49,4.59
SLYG,SPDR S&P 600 Small Cap Growth ETF (based on S&P SmallCap 600 G,62.16,0.21,up,0.34,7.51
SLYV,SPDR S&P 600 Small Cap Value ETF (based on S&P SmallCap Value,64.02,0.38,up,0.6,2.69
SMB,VanEck Vectors AMT-Free Short Municipal Index ETF,17.45,0.02,up,0.11,1.28
SMCP,AlphaMark Actively Managed Small Cap ETF,24.05,0.1101,up,0.46,-7.07
SMDD,UltraPro Short MidCap400,8.3509,-0.1976,down,2.31,-16.26
SMDV,ProShares Trust,60.35,0.25,up,0.42,13.1
SMEZ,SPDR EURO STOXX Small Cap ETF,55.7563,0.1783,up,0.32,-14.6
SMH,VanEck Vectors Semiconductor ETF,104.18,1.46,up,1.42,-0.94
SMHD,UBS AG,16.5,0.22,up,1.35,1.12
SMIN,"iShares, Inc.",35.35,0.29,up,0.83,-27.85
SMLF,iShares Edge MSCI Multifactor USA Small-Cap ETF,41.8,0.25,up,0.6,5.73
SMLL,Direxion Daily Small Cap Bull 2X Shares,49.5415,0.836,up,1.72,-2.58
SMLV,SPDR SSGA US Small Cap Low Volatility Index ETF,94.5,0.56,up,0.6,6.02
SMMD,iShares Trust,45.04,0.4898,up,1.1,1.74
SMMU,Short Term Municipal Bond Active Exchange-Traded Fund,50.03,-0.045,down,0.09,0.47
SMMV,iShares Trust,32.3866,0.1666,up,0.52,11.78
SMN,ProShares UltraShort Basic Materials,27.7687,-0.2885,down,1.03,7.51
SNLN,Highland/iBoxx Senior Loan ETF,17.65,0.055,up,0.31,-3.8
SNSR,Global X Internet of Things ETF,19.13,0.11,up,0.58,-6.76
SOCL,Global X Social Media ETF,31.37,0.61,up,1.98,-18.04
SOIL,Global X Fertilizers/Potash ETF,9.605,0.0208,up,0.22,-6.99
SOVB,Cambria ETF Trust,25.585,-0.065,down,0.25,-11.21
SOXL,Direxion Daily Semiconductor Bull 3x Shares,130.55,3.95,up,3.12,-18.81
SOXS,Direxion Daily Semiconductor Bear 3x Shares,7.3,-0.23,down,3.05,-41.4
SOXX,iShares PHLX SOX Semiconductor Sector Index Fund,185.5,1.97,up,1.07,2.09
SOYB,Teucrium Soybean Fund ETV,16.49,0,unch,0,-13.16
SPAB,SPDR Portfolio Aggregate Bond ETF,28.13,0.06,up,0.21,0.43
SPDN,Direxion Daily S&P 500 Bear 1X Shares,28.6,-0.1892,down,0.66,-4.73
SPDV,AAM S&P 500 High Dividend Value ETF,26.007,0.0884,up,0.34,-2.19
SPDW,SPDR Portfolio Developed World ex-US ETF,29.07,0.1,up,0.35,-8.53
SPEM,SPDR Index Shares Fund SPDR Portfolio Emerging Markets ETF,35.49,0.43,up,1.23,-12.66
SPFF,Global X SuperIncome Preferred ETF,11.59,0.0106,up,0.09,-3.02
SPHB,Invesco S&P 500 High Beta ETF,41.67,0.405,up,0.98,-4.19
SPHD,Invesco S&P 500 High Dividend Low Volatility ETF,42.28,-0.01,down,0.02,6.95
SPHQ,Invesco S&P 500 Quality ETF,31.28,0.3,up,0.97,1.44
SPIB,SPDR Portfolio Intermediate Term Corporate Bond ETF,33.7,0.09,up,0.27,0.21
SPLB,SPDR Portfolio Long Term Corporate Bond ETF,26.25,0.12,up,0.46,-2.43
SPLG,SPDR Series Trust SPDR Portfolio Large Cap ETF,32.85,0.24,up,0.74,3.1
SPLV,Invesco S&P 500 Low Volatility ETF,51.49,0.24,up,0.47,10.26
SPMD,SPDR Portfolio Mid Cap ETF,34.33,0.22,up,0.64,2.93
SPMO,Invesco S&P 500 Momentum ETF,38.36,0.37,up,0.97,4.34
SPMV,Invesco Exchange-Traded Fund Trust II,27.926,0.1498,up,0.54,5.29
SPPP,Sprott Physical Platinum and Palladium Trust,11.6139,0.2329,up,2.05,23.03
SPSB,SPDR Portfolio Short Term Corporate Bond ETF,30.4,0.03,up,0.1,0.5
SPSM,SPDR Portfolio Small Cap ETF,31.27,0.25,up,0.81,3.47
SPTL,SPDR Portfolio Long Term Treasury ETF,35.03,0.18,up,0.52,3.6
SPTM,SPDR Portfolio Total Stock Market ETF,34.89,0.21,up,0.61,3.62
SPTS,SPDR Portfolio Short Term Treasury ETF,29.64,0.025,up,0.08,0.07
SPUU,Direxion Daily S&P 500 Bull 2X Shares,50.8879,0.6273,up,1.25,-0.2
