Symbol,Name,LastSale,NetChange,NetChangeDirection,PercentChange,1YrPercentChange
IPE,SPDR Bloomberg Barclays TIPS ETF,54.8,0.17,up,0.31,-0.46
IPFF,iShares Trust,15.68,0.14,up,0.9,-16.23
IPKW,Invesco International BuyBack Achievers ETF,31.4609,0.2789,up,0.89,-18.48
IPO,Renaissance IPO ETF,29.85,0.6298,up,2.16,1.25
IPOS,Renaissance Capital Greenwich Fund,20.98,0.19,up,0.91,-16.57
IQDE,FlexShares International Quality Dividend Defensive Index Fund,22.23,0.09,up,0.41,-13.99
IQDF,FlexShares International Quality Dividend Index Fund,23.32,0.13,up,0.56,-13.92
IQDG,WisdomTree Trust,28.2304,0.1908,up,0.68,-9.81
IQDY,FlexShares International Quality Dividend Dynamic Index Fund,24.476,0.167,up,0.69,-16.32
IQIN,IQ 500 International ETF,27.0221,0.0792,up,0.29,5.34
IQLT,iShares Edge MSCI Intl Quality Factor ETF,28.7,0.13,up,0.46,-3.38
IRBO,iShares Robotics and Artificial Intelligence ETF,24.67,0.42,up,1.73,2.71
ISCF,iShares Edge MSCI Intl Size Factor ETF,28.69,0.21,up,0.74,-12.85
ISDS,Invesco Strategic Developed ex-US Small Company ETF,23.34,0.79,up,3.5,-11.79
ISDX,Invesco Strategic Developed ex-US ETF,23.43,0,unch,0,-9.9
ISHG,iShares 1-3 Year International Treasury Bond ETF,79.4481,0.0608,up,0.08,-8.22
ISMD,Inspire Small/Mid Cap Impact ETF,27.2255,0.1415,up,0.52,3.16
ISRA,VanEck Vectors Israel ETF,31.805,0.255,up,0.81,2.87
ISTB,iShares Core 1-5 Year USD Bond ETF,49.51,0.07,up,0.14,0.41
ISZE,iShares Edge MSCI Intl Size Factor ETF,26.0941,0.1213,up,0.47,-7.51
ITA,iShares Trust,209.45,2.04,up,0.98,3.13
ITB,iShares Trust,35.88,0.38,up,1.07,-12.41
ITE,SPDR Bloomberg Barclays Intermediate Term Treasury ETF,59.57,0.11,up,0.18,1.72
ITEQ,BlueStar Israel Technology ETF,36.6705,0.3205,up,0.88,10.65
ITM,VanEck Vectors AMT-Free Intermediate Municipal Index ETF,48.08,0.105,up,0.22,2.86
ITOT,iShares Core S&P Total U.S. Stock Market ETF,63.91,0.41,up,0.65,2.85
IUS,Invesco Strategic US ETF,24.3,0,unch,0,-3.23
IUSB,iShares Core Total USD Bond Market ETF,49.87,0.09,up,0.18,0.3
IUSG,iShares Core S&P U.S. Growth ETF,58.87,0.52,up,0.89,4.53
IUSS,Invesco Strategic US Small Company ETF,23.32,0,unch,0,-7.46
IUSV,iShares Core S&P U.S. Value ETF,55.08,0.21,up,0.38,0.79
IVAL,ValueShares U.S. Quantitative Value ETF,28.365,0.1506,up,0.53,-14.54
IVE,iShares S&P 500 Value ETF,113.05,0.39,up,0.35,0.37
IVENC,Ivy NextShares,100.02,0,unch,0,0
IVFVC,Ivy NextShares,100.02,0,unch,0,0
IVLU,iShares Edge MSCI Intl Value Factor ETF,23.7137,0.0537,up,0.23,-10.58
IVOG,Vanguard S&P Mid-Cap 400 Growth ETF,135.93,1.27,up,0.94,-0.19
IVOO,Vanguard S&P Mid-Cap 400 ETF,130.38,0.95,up,0.73,2.03
IVOV,Vanguard S&P Mid-Cap 400 Value ETF,123.87,0.78,up,0.63,4.3
IVV,iShares Core S&P 500 ETF,280.82,1.61,up,0.58,2.65
IVW,iShares S&P 500 Growth ETF,168.05,1.48,up,0.89,4.89
IWB,iShares Russell 1000 ETF,155.55,1.02,up,0.66,2.83
IWC,iShares Microcap ETF,97,1.02,up,1.06,-0.06
IWD,iShares Russell 1000 Value ETF,123.72,0.47,up,0.38,0.46
IWF,iShares Russell 1000 Growth ETF,147.77,1.36,up,0.93,5.1
IWL,iShares Russell Top 200 ETF,64.71,0.46,up,0.72,2.83
IWM,iShares Russell 2000 ETF,158.15,1.36,up,0.87,2.99
IWN,iShares Russell 2000 Value ETF,125.8,0.77,up,0.62,1.43
IWO,iShares Russell 2000 Growth ETF,200.12,2.24,up,1.13,4.35
IWP,iShares Russell Midcap Growth ETF,133.87,1.39,up,1.05,7.31
IWR,iShares Russell Mid-Cap ETF,53.84,0.37,up,0.69,2.98
IWS,iShares Russell Mid-cap Value ETF,87.45,0.39,up,0.45,-0.16
IWV,iShares Russell 3000 ETF,165.37,1.08,up,0.66,2.89
IWX,iShares Russell Top 200 Value ETF,52.48,0.09,up,0.17,0.52
IWY,iShares Russell Top 200 Growth ETF,80.05,0.68,up,0.86,4.52
IXC,iShares Global Energy ETF,33.5,0.11,up,0.33,-0.18
IXG,iShares Global Financial ETF,62.74,0.09,up,0.14,-13.15
IXJ,iShares Global Healthcare ETF,60.78,0.37,up,0.61,6.59
IXN,iShares Global Tech ETF,164.41,2.14,up,1.32,0.89
IXP,iShares Global Comm Services ETF,55.3,0.6444,up,1.18,-5.29
IXUS,iShares Core MSCI Total International Stock ETF,57.59,0.29,up,0.51,-9.98
IYC,iShares U.S. Consumer Services ETF,201.3096,1.2196,up,0.61,6.46
IYE,iShares U.S. Energy ETF,35.79,0.11,up,0.31,-2.11
IYF,iShares U.S. Financial ETF,119.39,0.17,up,0.14,-1.29
IYG,iShares U.S. Financial Services ETF,127.96,0.27,up,0.21,-7.06
IYH,iShares U.S. Healthcare ETF,194.81,1.89,up,0.98,8.5
IYJ,iShares Trust,151.935,1.035,up,0.69,1.1
IYK,iShares U.S. Consumer Goods ETF,116.8,-0.1665,down,0.14,-3.93
IYLD,"iShares, Inc.",24.5104,0.0904,up,0.37,-1.53
IYM,iShares U.S. Basic Materials ETF,93.24,0.44,up,0.47,-8.88
IYR,iShares U.S. Real Estate ETF,84.99,0.45,up,0.53,15.97
IYT,iShares Trust,190.73,-0.68,down,0.36,2.34
IYW,iShares U.S. Technology ETF,183.05,2.31,up,1.28,5.42
IYY,iShares Dow Jones U.S. ETF,139.8,0.9409,up,0.68,2.8
IYZ,iShares Trust,29.79,0.29,up,0.98,6.96
IZRL,ARK ETF Trust,21.99,0.1398,up,0.64,4.7
JAGG,JPMorgan U.S. Aggregate Bond ETF,25.47,0.0636,up,0.25,1.5
JCPB,J.P. Morgan Exchange-Traded Fund Trust,50.6761,0.0811,up,0.16,0.56
JDIV,JPMorgan U.S. Dividend ETF,26.1285,0.0589,up,0.23,2.84
JDST,Direxion Daily Junior Gold Miners Index Bear 3X Shares,33.94,-0.29,down,0.85,-42.65
JETS,U.S. Global Jets ETF,31.2,0.24,up,0.78,-3.76
JHDG,WisdomTree Japan Hedged Quality Dividend Growth Fund,26.0325,0.0925,up,0.36,-8.08
JHEM,John Hancock Multifactor Emerging Markets ETF,25.5672,0.2833,up,1.12,0.6
JHMA,John Hancock Multifactor Materials ETF,32.4858,0.2226,up,0.69,-9.6
JHMC,John Hancock Multifactor Consumer Discretionary ETF,31.8565,0.2339,up,0.74,0.03
JHMD,John Hancock Exchange-Traded Fund Trust John Hancock Multifact,27.94,0.1432,up,0.52,-8.86
JHME,John Hancock Multifactor Energy ETF,26.2853,0.1033,up,0.39,-6.4
JHMF,John Hancock Multifactor Financials ETF,35.8408,0.1069,up,0.3,-7.03
JHMH,John Hancock Multifactor Healthcare ETF,34.5518,0.3319,up,0.97,7.44
JHMI,John Hancock Multifactor Industrials ETF,35.7313,0.2402,up,0.68,-0.59
JHML,John Hancock Multifactor Large Cap ETF,36.1019,0.2327,up,0.65,2.14
JHMM,John Hancock Multifactor Mid Cap ETF,35.22,0.25,up,0.71,1.66
JHMS,John Hancock Multifactor Consumer Staples ETF,26.326,-0.084,down,0.32,-0.71
JHMT,John Hancock Multifactor Technology ETF,46.2759,0.562,up,1.23,5.06
JHMU,John Hancock Multifactor Utilities ETF,30.6665,0.1557,up,0.51,17.12
JHSC,John Hancock Multifactor Small Cap ETF,26.63,0.1,up,0.38,2.59
JIGB,JPMorgan Corporate Bond Research Enhanced ETF,51.535,0.115,up,0.22,2.5
JJA,Barclays PLC,45.5851,0.0452,up,0.1,-1.11
JJC,Barclays PLC,45.431,0.632,up,1.41,4.43
JJG,Barclays PLC,46.85,-0.0308,down,0.07,-1.22
JJP,Barclays PLC,48.2093,0.204,up,0.42,10.25
JJS,Barclays PLC,42.03,0.125,up,0.3,-5.11
JJU,Barclays PLC,44.4314,0.2897,up,0.66,-2.52
JKD,iShares Morningstar Large-Cap ETF,157.6031,0.7731,up,0.49,-1.13
JKE,iShares Morningstar Large-Cap Growth ETF,178.5389,1.7789,up,1.01,6.91
JKF,iShares Morningstar Large-Cap  Value ETF,105.7502,0.2602,up,0.25,1.05
JKG,iShares Morningstar Mid-Cap ETF,188.6491,1.2638,up,0.67,1.85
JKH,iShares Morningstar Mid-Cap Growth ETF,229.3176,2.7878,up,1.23,8.56
JKI,iShares Morningstar Mid-Cap ETF,158.31,0.71,up,0.45,0
JKJ,iShares Morningstar Small-Cap ETF,174.3137,1.0837,up,0.63,1.22
JKK,iShares Morningstar Small-Cap Growth ETF,199.93,2.1605,up,1.09,8.98
JKL,iShares Morningstar Small-Cap Value ETFnd,144.9523,0.6649,up,0.46,-1.41
JMIN,JPMorgan U.S. Minimum Volatility ETF,27.4473,0.0584,up,0.21,6.58
JMOM,JPMorgan U.S. Momentum Factor ETF,27.1775,0.24,up,0.89,2.05
JMST,J.P. Morgan Exchange-Traded Fund Trust,50.36,0,unch,0,0.62
JMUB,J.P. Morgan Exchange-Traded Fund Trust,52.025,0,unch,0,3.82
JNK,SPDR Bloomberg Barclays High Yield Bond ETF,35.59,0.06,up,0.17,-1.44
JNUG,Direxion Daily Junior Gold Miners Index Bull 3X Shares,12.36,0.12,up,0.98,-7.27
JO,Barclays PLC,35.8752,0.2652,up,0.74,0
JPED,JPMorgan Event Driven ETF,25.4929,0.0866,up,0.34,0.91
JPEH,JPMorgan Diversified Return Europe Currency Hedged ETF,27.22,0.115,up,0.42,-1.44
JPEM,JPMorgan Diversified Return Emerging Markets Equity ETF,54.77,0.43,up,0.79,-11.77
JPEU,JPMorgan Diversified Return Europe Equity ETF,55.3988,0.222,up,0.4,-8.79
JPGB,J.P. Morgan Exchange-Traded Fund Trust,48.75,-0.015,down,0.03,-4.02
JPGE,JPMorgan Diversified Return Global Equity ETF,59.4103,0.3503,up,0.59,-4.72
JPHF,J P Morgan Chase & Co ETF,25,0.07,up,0.28,-2.35
JPHY,J.P. Morgan Exchange-Traded Fund Trust,49.925,0.06,up,0.12,-1.32
JPIH,JPMorgan Diversified Return International Currency Hedged ETF,28.749,0.1247,up,0.44,-1.14
JPIN,JPMorgan Diversified Return International Equity ETF,55.59,0.24,up,0.43,-6.6
JPLS,JPMorgan Long/Short ETF,22.1867,0.0493,up,0.22,-7.25
JPMB,JPMorgan USD Emerging Markets Sovereign Bond ETF,47.66,0.12,up,0.25,-3.28
JPME,JPMorgan Diversified Return U.S. Mid Cap Equity ETF,65.2377,0.3167,up,0.49,1.88
JPMF,JPMorgan Managed Futures Strategy ETF,23.67,0.0985,up,0.42,-5.38
JPMV,iShares Edge MSCI Min Vol Japan ETF,66.0608,0.0916,up,0.14,-4.5
JPN,Japan Index,26.6,0.0294,up,0.11,-10.17
JPNL,Direxion Daily Japan Bull 3X ETF,52.3,0.39,up,0.75,-32.93
JPSE,JPMorgan Diversified Return U.S. Small Cap Equity ETF,31.23,0.2606,up,0.84,6.65
JPST,J.P. Morgan Exchange-Traded Fund Trust,50.32,0,unch,0,0.5
JPUS,JPMorgan Diversified Return U.S. Equity ETF,73.25,0.4,up,0.55,3.1
JPXN,iShares JPX-Nikkei 400 ETF,58.79,0.15,up,0.26,-11
JQUA,JPMorgan U.S. Quality Factor ETF,27.7364,0.23,up,0.84,4.7
JSMD,Janus Henderson Small/Mid Cap Growth Alpha ETF,44.13,0.38,up,0.87,9.16
JSML,Janus Henderson Small Cap Growth Alpha ETF,43.01,0.43,up,1.01,14.06
JUST,Goldman Sachs JUST U.S. Large Cap Equity ETF,40.1091,0.2691,up,0.68,-0.82
JVAL,JPMorgan U.S. Value Factor ETF,26.3071,0.1385,up,0.53,-0.53
JXI,iShares Global Utilities ETF,52.96,0.22,up,0.42,12.93
KALL,KraneShares MSCI All China Index ETF,24.5693,0.5404,up,2.25,-15.77
KARS,KraneShares Electric Vehicles and Future Mobility Index ETF,20.9569,0.5171,up,2.53,-15.71
KBA,KraneShares Bosera MSCI China A ETF,29.38,0.73,up,2.55,-19.97
KBE,SPDR S&P Bank ETF,45.56,0.14,up,0.31,-10.15
KBWB,Invesco KBW Bank ETF,51.55,-0.12,down,0.23,-12.19
KBWD,Invesco KBW High Dividend Yield Financial ETF,22.4,0.23,up,1.04,-1.25
KBWP,Invesco KBW Property & Casualty Insurance ETF,63.13,0.119,up,0.19,4.98
KBWR,Invesco KBW Regional Banking ETF,54.001,-0.129,down,0.24,-7.6
KBWY,Invesco KBW Premium Yield Equity REIT ETF,31.3264,0.1264,up,0.41,2.7
KCCB,KraneShares CCBS China Corporate High Yield Bond USD Index ETF,40.34,0.01,up,0.02,0.37
KCE,SPDR S&P Capital Markets ETF,54.7166,0.4852,up,0.89,-8.6
KCNY,KraneShares E Fund China Commercial Paper ETF,34.58,0.18,up,0.52,-6.37
KEMQ,KraneShares Emerging Markets Consumer Technology Index ETF,21.9286,0.5687,up,2.66,-23
KFYP,KraneShares CICC China Leaders 100 Index ETF,25.5067,0.4517,up,1.8,-25.76
KGRN,KraneShares MSCI China Environment Index ETF,20.54,0.4316,up,2.15,-20.36
KIE,SPDR S&P Insurance ETF,31.74,0.07,up,0.22,2.59
KLDW,Knowledge Leaders Developed World ETF,32.2983,0.2183,up,0.68,-6.01
KNG,ETF Series Solutions,42.3594,0.273,up,0.65,5.78
KNOW,Direxion All Cap Insider Sentiment Shares,39.61,0.29,up,0.74,-4.93
KOIN,Innovation Shares NextGen Protocol ETF,24.89,0.2696,up,1.1,1.57
KOL,VanEck Vectors Coal ETF,14.06,0.11,up,0.79,-19.92
KOLD,ProShares UltraShort Bloomberg Natural Gas,21.56,-0.02,down,0.09,-51.23
KORP,American Century Diversified Corporate Bond ETF,49.2401,0.2026,up,0.41,-1.31
KORU,Direxion Daily South Korea Bull 3X Shares,31.5,0.87,up,2.84,-44.29
KRE,SPDR S&P Regional Banking ETF,57.03,0.17,up,0.3,-9.99
KRMA,Global X Conscious Companies ETF,20.8207,0.1007,up,0.49,5.5
KSA,iShares Trust iShares MSCI Saudi Arabia ETF,32.04,0.1,up,0.31,17.51
KURE,KraneShares MSCI All China Health Care Index ETF,20.38,0.69,up,3.5,-19.63
KWEB,KraneShares Trust KraneShares CSI China Internet ETF,46.07,1.77,up,4,-32.1
KXI,iShares Global Consumer Staples ETF,49.74,-0.12,down,0.24,-0.93
LABD,Direxion Daily S&P Biotech Bear 3X Shares,23.09,-1.46,down,5.95,-28.22
LABU,Direxion Daily S&P Biotech Bull 3X Shares,52.85,2.89,up,5.78,-45.08
LBDC,UBS AG,14.8655,0.4628,up,3.21,0.14
LBJ,Direxion Daily Latin America 3x Bull Shares,27.427,0.9816,up,3.71,-38.18
LD,Barclays PLC,41.2,0,unch,0,0
LDRI,Invesco LadderRite 0-5 Year Corporate Bond ETF,24.81,0.0862,up,0.35,0.65
LDRS,Innovator IBD ETF Leaders ETF,21.815,0.2251,up,1.04,-15.03
LDSF,First Trust Low Duration Strategic Focus ETF,20.32,0.02,up,0.1,0.35
LDUR,PIMCO Enhanced Low Duration Active Exchange-Traded Fund,99.46,0.12,up,0.12,-0.58
LEAD,Reality Shares ETF Trust,33.72,0.2184,up,0.65,2.46
LEGR,First Trust Indxx Innovative Transaction & Process ETF,28.808,0.378,up,1.33,-1.86
LEMB,iShares J.P. Morgan EM Local Currency Bond,44.96,0.12,up,0.27,-10.12
LFEQ,VanEck Vectors NDR CMG Long/Flat Allocation ETF,26.13,0.06,up,0.23,-1.62
LGLV,SPDR SSGA US Large Cap Low Volatility Index ETF,98.74,0.49,up,0.5,8.16
LGOV,First Trust Long Duration Opportunities ETF,25.425,-0.025,down,0.1,1.78
LIT,Global X Lithium & Battery Tech ETF,29.78,0.16,up,0.54,-17.65
LKOR,FlexShares Credit-Scored US Long Corporate Bond Index Fund,50.21,0.21,up,0.42,-3.14
LLQD,iShares Trust,47.06,0.2376,up,0.51,-3.7
LMBS,First Trust Low Duration Opportunities ETF,51.14,0.04,up,0.08,-0.43
LMLP,ETRACS 2X Wells Fargo - BDCI,13.7935,0.005,up,0.04,-18.79
LNGR,Global X Longevity Thematic ETF,21.2622,-0.0648,down,0.3,5.49
LOUP,Innovator Loup Frontier Tech E,24.55,0.4477,up,1.86,-4.74
LOWC,SPDR MSCI ACWI Low Carbon Target ETF,88.2123,0.6367,up,0.73,-4.27
LQD,iShares iBoxx $ Investment Grade Corporate Bond ETF,116.38,0.52,up,0.45,-0.56
LQDH,iShares Interest Rate Hedged Corporate Bond ETF,93.31,0.03,up,0.03,-4.3
LQDI,iShares U.S. ETF Trust,24.725,0.125,up,0.51,-1.6
LRET,UBS AG,25.7545,0.2925,up,1.15,28.4
LRGE,ClearBridge Large Cap Growth ESG ETF,32.31,0.15,up,0.47,5.44
LRGF,iShares Edge MSCI Multifactor USA ETF,31.47,0.29,up,0.93,-2.26
LSAF,LeaderShares AlphaFactor US Core Equity ETF,24.2259,0.138,up,0.57,-3.91
LSST,Natixis ETF Trust Natixis Loomis Sayles Short Duration Income,24.865,0.035,up,0.14,-0.64
LTL,ProShares Ultra Telecommunications ProShares,41.5691,0.8647,up,2.12,2.83
LTPZ,Pimco 15  Year U.S. TIPS Index Exchange-Traded Fund,64.1,0.49,up,0.77,-1.46
LVHB,Innovator ETFs Trust II,32.82,0.14,up,0.43,1.4
LVHD,Legg Mason Low Volatility High Dividend ETF,31.55,0.0028,up,0.01,5.17
LVHE,Legg Mason ETF Investment Trust,27.0089,0.104,up,0.39,-5.76
LVHI,Legg Mason ETF Investment Trust,25.8699,0.0872,up,0.34,-3.9
LVIN,Lattice Strategies Trust,26.585,0.1557,up,0.59,-5.78
LVL,Invesco S&P Global Dividend Opportunities Index ETF,11.21,0.115,up,1.04,-0.4
LVUS,Lattice Strategies Trust,28.3744,0.1395,up,0.49,6.43
MAGA,ETF Series Solutions,26.7466,0.0871,up,0.33,-4.27
MBB,iShares MBS ETF,105.25,0.12,up,0.11,1.06
MBG,SPDR Bloomberg Barclays Mortgage Backed Bond ETF,25.575,0.005,up,0.02,0.55
MBSD,FlexShares Disciplined Duration MBS Index Fund,23.07,-0.0392,down,0.17,-0.52
MCEF,First Trust Municipal CEF Income Opportunity ETF,18.1182,0.0804,up,0.45,0.39
MCHI,iShares MSCI China ETF,60.93,1.15,up,1.92,-16.13
MCRO,IQ Hedge Macro Tracker ETF,25.9911,0.0811,up,0.31,-2.59
MDIV,First Trust Multi-Asset Diversified Income Index Fund,18.35,0.02,up,0.11,0.05
MDY,SPDR MidCap Trust Series I,352.26,2.65,up,0.76,2.02
MDYG,SPDR S&P 400 Mid Cap Growth ETF (based on S&P MidCap 400 Growt,52.85,0.47,up,0.9,-0.35
MDYV,SPDR S&P 400 Mid Cap Value ETF (based on S&P MidCap 400 Value,52.21,0.3,up,0.58,4
MEAR,iShares U.S. ETF Trust,50,0.02,up,0.04,0.48
MEXX,Direxion Daily MSCI Mexico Bull 3X Shares,11.8844,0.3619,up,3.14,-47.45
MFDX,PIMCO Equitiy Series PIMCO RAFI Dynamic Multi-Factor Internati,24.3627,0.1041,up,0.43,-8.83
MFEM,PIMCO Equitiy Series PIMCO RAFI Dynamic Multi-Factor Emerging,23.7851,0.2467,up,1.05,-12.4
MFUS,PIMCO Equitiy Series PIMCO RAFI Dynamic Multi-Factor U.S. Equi,28.0928,0.1785,up,0.64,-0.14
MGC,Vanguard Mega Cap ETF,96.44,0.6413,up,0.67,2.85
MGK,Vanguard Mega Cap Growth ETF,120.27,0.96,up,0.8,3.39
MGV,Vanguard Mega Cap Value ETF,78.45,0.35,up,0.45,2.57
MIDU,Direxion Mid Cap Bull 3X Shares,43.57,0.99,up,2.33,-4.19
MIDZ,Direxion Mid Cap Bear 3X Shares,11.02,-0.2519,down,2.23,-16.46
MILN,Global X Millennials Thematic ETF,23.12,0.4182,up,1.84,11.6
MINC,AdvisorShares Newfleet Multi-sector Income ETF,47.77,-0.035,down,0.07,-0.63
MINT,PIMCO Enhanced Short Maturity Active Exchange-Traded Fund,101.41,0.01,up,0.01,-0.16
MJ,ETFMG Alternative Harvest ETF,36.54,0.43,up,1.19,0
MLN,VanEck Vectors AMT-Free Long Municipal Index ETF,19.73,-0.02,down,0.1,0.66
MLPA,Global X MLP ETF,8.72,0,unch,0,-7.82
MLPB,UBS AG,22.3815,0.0603,up,0.27,-7.42
MLPC,Citigroup Inc.,14.0027,0.0416,up,0.3,-7.3
MLPE,Citigroup Inc.,21.2694,0.1092,up,0.52,-11.65
MLPG,UBS AG,22.7409,-0.0257,down,0.11,-4.73
MLPI,ETRACS 2X Wells Fargo - BDCI,22.3,-0.01,down,0.04,-4.7
MLPO,Credit Suisse AG,13.8445,0.017,up,0.12,-1.43
MLPQ,UBS AG,28.96,0.17,up,0.59,-17.41
MLPX,Global X MLP & Energy Infrastructure ETF,12.89,0.01,up,0.08,0.19
MLPY,Morgan Stanley,6.2451,0.0148,up,0.24,-10.3
MLPZ,UBS AG,33.5628,0.1391,up,0.42,-17.56
MLQD,iShares Trust,48.485,0.14,up,0.29,0.38
MLTI,Credit Suisse X-Links Multi-Asset High Income Exchange Traded,27.3987,0.1392,up,0.51,-0.44
MMIN,IQ MacKay Municipal Insured ETF,25.25,0.02,up,0.08,1.45
MMIT,IQ MacKay Municipal Intermediate ETF,25.25,-0.02,down,0.08,4.18
MMTM,SPDR S&P 1500 Momentum Tilt ETF,121.4159,0.4359,up,0.36,1.37
MNA,IQ Merger Arbitrage ETF,32.23,-0.04,down,0.12,2.97
MOAT,VanEck Vectors Morningstar Wide Moat ETF,46.77,0.2,up,0.43,8.28
MOGLC,Gabelli NextShares Trust,99.96,0,unch,0,-0.08
MOM,AGFiQ U.S. Market Neutral Momentum Fund,23.2625,-0.0825,down,0.35,-7.47
MOO,VanEck Vectors Agribusiness ETF,62.51,0.16,up,0.26,-0.27
MORL,ETRACS 2X Wells Fargo - BDCI,14.75,0.04,up,0.27,3.59
MORT,VanEck Vectors Mortgage REIT Income ETF,23.32,0.17,up,0.73,4.33
MOTI,VanEck Vectors Morningstar International Moat ETF,31.5859,0.1316,up,0.42,-9.52
MRGR,ProShares Trust,37.3,-0.15,down,0.4,5.14
AAAU,Perth Mint Physical Gold ETF,13.275,0.05,up,0.38,12.65
AADR,AdvisorShares Dorsey Wright ADR ETF,46.12,0.4899,up,1.07,-25.44
AAXJ,iShares MSCI All Country Asia ex Japan Index Fund,70.02,0.77,up,1.11,-11.09
ACES,ALPS ETF Trust,27.0505,0.6035,up,2.28,4.92
ACIM,SPDR MSCI ACWI IMI ETF,77.4,0.6416,up,0.84,-3.99
ACSG,Xtrackers MSCI ACWI ex USA ESG Leaders Equity ETF,25.98,0.18,up,0.7,6.83
ACSI,ETF Series Solutions,32.5648,0.1382,up,0.43,4.41
ACT,AdvisorShares Vice ETF,25.0889,0.1389,up,0.56,-2.73
ACWF,iShares Edge MSCI Multifactor Global ETF,29.38,0.25,up,0.86,-7.52
ACWI,iShares MSCI ACWI Index Fund,71.2,0.43,up,0.61,-2.96
ACWV,"iShares, Inc.",87.64,0.38,up,0.44,4.83
ACWX,iShares MSCI ACWI ex US Index Fund,45.95,0.28,up,0.61,-9.29
ADRA,Invesco BLDRS Asia 50 ADR Index Fund,30.7434,0,unch,0,-14.59
ADRD,Invesco BLDRS Developed Markets 100 ADR Index Fund,21.3422,0.034,up,0.16,-8.5
ADRE,Invesco BLDRS Emerging Markets 50 ADR Index Fund,40.5644,0.4832,up,1.21,-11.93
ADRU,Invesco BLDRS Europe Select ADR Index Fund,20.71,-0.1211,down,0.58,-9.24
AFIF,Two Roads Shared Trust,9.995,-0.01,down,0.1,0.05
AFK,VanEck Vectors-Africa Index ETF,22.31,0.2646,up,1.2,-15.21
AFTY,CSOP FTSE China A50 ETF,15.564,0.2949,up,1.93,-18.3
AGF,PowerShares DB Gold Fund,9.98,2.04,up,25.69,-18.48
AGG,iShares Core U.S. Aggregate Bond ETF,107.4,0.27,up,0.25,0.73
AGGE,IQ Enhanced Core Bond U.S. ETF,18.64,0.025,up,0.13,-0.88
AGGP,IQ Enhanced Core Plus Bond U.S. ETF,18.98,0,unch,0,-1.04
AGGY,WisdomTree Yield Enhanced U.S. Aggregate Bond Fund,48.9083,0.0933,up,0.19,-0.4
AGND,WisdomTree Barclays Negative Duration U.S. Aggregate Bond Fund,42.8385,0.1285,up,0.3,-4.04
AGQ,ProShares Ultra Silver,27.46,0.34,up,1.25,-14.58
AGT,iShares Trust,23.7047,0.4796,up,2.07,-26.64
AGZ,iShares  Agency Bond ETF,112.29,0.1206,up,0.11,0.87
AGZD,WisdomTree Interest Rate Hedged U.S. Aggregate Bond Fund,47.56,-0.005,down,0.01,-1.07
AIA,iShares Asia 50 ETF,61.5,0.73,up,1.2,-11.28
AIEQ,AI Powered Equity ETF,25.79,0.22,up,0.86,-3.73
AIIQ,AI Powered International Equity ETF,23.6024,0.1479,up,0.63,-7.4
AIQ,Global X Future Analytics Tech ETF,15.3166,0.1466,up,0.97,0.86
AIRR,First Trust RBA American Industrial Renaissance ETF,25.71,0.14,up,0.55,-3.51
ALD,WisdomTree Asia Local Debt Fund ETF,44.545,0.164,up,0.37,-3.88
ALFA,ETF Series Solutions,48.3966,0.7398,up,1.55,4.29
ALTS,ProShares Trust,37.0916,-0.0042,down,0.01,-1.24
ALTY,Global X SuperDividend Alternatives ETF,14.9001,0.115,up,0.78,0.24
AMCA,iShares Russell 1000 Pure U.S. Revenue ETF,27.74,0.1749,up,0.63,2.17
AMJ,J P Morgan Chase & Co,25.55,0.02,up,0.08,-5.72
AMJL,Credit Suisse AG,14.82,0.0258,up,0.17,-21.2
AMLP,Alerian MLP ETF,9.84,-0.02,down,0.2,-5.37
AMU,ETRACS 2X Wells Fargo - BDCI,16.09,0.04,up,0.25,-6.03
AMUB,UBS AG,16.1116,0.0373,up,0.23,-6.49
AMZA,InfraCap MLP ETF,5.96,0.01,up,0.17,-24.97
ANGL,VanEck Vectors Fallen Angel High Yield Bond,28.54,0.04,up,0.14,-3
AOA,iShares Core Aggressive Allocation ETF,52.95,0.3,up,0.57,-2.63
AOK,iShares Core Conservative Allocation ETF,34.06,0.1355,up,0.4,-0.96
AOM,iShares Core Moderate Allocation ETF,37.54,0.18,up,0.48,-1.03
AOR,iShares Core Growth Allocation ETF,44.15,0.22,up,0.5,-1.92
ARCM,Arrow Investments Trust,100.12,0.01,up,0.01,-0.02
ARGT,Global X MSCI Argentina ETF,27.71,0.6,up,2.21,-26.29
ARKG,ARK Genomic Revolution Multi-Sector ETF,29.47,0.48,up,1.66,8.54
ARKK,ARK Innovation ETF,45.77,1.07,up,2.39,8.84
ARKQ,ARK Industrial Innovation ETF,35.11,0.45,up,1.3,-0.97
ARKW,ARK Web x.0 ETF,51.72,1.38,up,2.74,-1.78
ASEA,Global X FTSE Southeast Asia ETF,16.23,0.18,up,1.12,-11.18
ASET,FlexShares Real Assets Allocation Index Fund,28.48,0.1969,up,0.7,2.72
ASHR,Xtrackers Harvest CSI 300 China A-Shares ETF,26.47,0.79,up,3.08,-19.22
ASHS,Xtrackers Harvest CSI 500 China A-Shares Small Cap ETF,26.51,0.91,up,3.55,-23.88
ASHX,Xtrackers MSCI China A Inclusion Equity ETF,19.0135,0.5535,up,3,-17.07
ATMP,Barclays PLC,20.4,0.05,up,0.25,-0.73
AUGR,Defiance Future Tech ETF,23.0472,0.3575,up,1.58,-9.75
AUSE,WisdomTree Australia Dividend Index,53.5693,0.532,up,1,-10.27
AUSF,Global X Funds Global X Adaptive U.S. Factor ETF,24.3019,0.0281,up,0.12,-3.06
AWTM,Aware Ultra-Short Duration Enhanced Income ETF,50.21,0.005,up,0.01,0.33
AXJL,WisdomTree Asia Pacific ex-Japan Total Dividend Fund,67.526,0.6758,up,1.01,-6.2
AXJV,iShares Edge MSCI A Min Vol Asia ex Japan ETF,35.8305,0.2005,up,0.56,-4.91
BAB,Invesco Taxable Municipal Bond ETF,29.75,0.06,up,0.2,1.19
BAL,Barclays PLC,43.9166,-0.686,down,1.54,-7.68
BAR,Graniteshares Gold Trust,132.4874,0.4538,up,0.34,-0.15
BATT,Amplify Advanced Battery Metals and Materials ETF,13.1454,0.2109,up,1.63,-36.48
BBAX,J.P. Morgan Exchange-Traded Fund Trust,25.3,0.27,up,1.08,-1.92
BBC,Virtus LifeSci Biotech Clinical Trials ETF,25.9983,0.4457,up,1.74,-23.04
BBCA,J.P. Morgan Exchange-Traded Fund Trust,24.14,0.16,up,0.67,-2.95
BBEU,J.P. Morgan Exchange-Traded Fund Trust,23.29,0.09,up,0.39,-6.22
BBH,VanEck Vectors Biotech ETF,128.1,2.07,up,1.64,3.06
BBJP,J.P. Morgan Exchange-Traded Fund Trust,22.73,0.08,up,0.35,-8.3
BBP,Virtus LifeSci Biotech Products ETF,41.4812,0.7363,up,1.81,-3.06
BBRC,Columbia Beyond BRICs ETF,16.9764,0.1164,up,0.69,-14.85
BBRE,J.P. Morgan Exchange-Traded Fund Trust,82.3065,0.4645,up,0.57,8.67
BCD,Aberdeen Standard Bloomberg All Commodity Longer Dated Strateg,24.8259,0.0794,up,0.32,-5.65
BCI,Aberdeen Standard Bloomberg All Commodity Strategy K-1 Free ET,22.88,0.04,up,0.18,-6.7
BCM,Barclays PLC,28.2784,0.1073,up,0.38,-4.27
BCNA,Reality Shares Nasdaq NexGen Economy China ETF,21.5398,0.7998,up,3.86,-14.3
BDCL,ETRACS 2X Wells Fargo - BDCI,14.82,0.55,up,3.85,-0.76
BDCS,ETRACS 2X Wells Fargo - BDCI,20.225,0.375,up,1.89,2.21
BDCZ,UBS AG,20.2105,0.3268,up,1.64,1.45
BDD,PowerShares DB Gold Fund,7.5412,0.1512,up,2.05,-31.83
BDRY,Breakwave Dry Bulk Shipping ETF,10.925,0.23,up,2.15,-58.08
BEF,Aberdeen Standard Bloomberg Energy Commodity Longer Dated Stra,25.5396,0.0286,up,0.11,2.53
BEMO,ETF Series Solutions,28.3895,0.1919,up,0.68,-12.45
BERN,Exchange Traded Concepts Trust,27.7511,-0.0523,down,0.19,0.15
BFIT,Global X Health & Wellness Thematic ETF,19.17,-0.18,down,0.93,13.56
BFOR,Barron's 400,41.4201,0.2782,up,0.68,-1.93
BGRN,iShares Global Green Bond ETF,51.76,0.1368,up,0.26,2.77
BIB,ProShares Ultra Nasdaq Biotechnology,54.84,1.63,up,3.06,-7.88
BIBL,Inspire 100 ETF,26.995,0.214,up,0.8,0.68
BICK,First Trust BICK Index Fund,27.64,0.47,up,1.73,-14.32
BIKR,Rogers AI Global Macro ETF,24.5835,0.109,up,0.45,-1.67
BIL,SPDR Bloomberg Barclays 1-3 Month T-Bill ETF,91.58,0.02,up,0.02,0.1
BIS,ProShares UltraShort Nasdaq Biotechnology,17.3,-0.51,down,2.86,-13.5
BIV,Vanguard Intermediate-Term Bond ETF,82.45,0.23,up,0.28,1.21
BIZD,VanEck Vectors BDC Income ETF,16.73,0.24,up,1.46,3.06
BJAN,Innovator ETFs Trust,27.4382,0.1322,up,0.48,8.2
BJK,VanEck Vectors Gaming ETF,38.289,0.1924,up,0.51,-20.58
BJUL,Innovator ETFs Trust,25.1884,0.0645,up,0.26,-1.99
BKCH,AdvisorShares Sabretooth ETF,25.75,0.395,up,1.56,2.65
BKF,iShares MSCI BRIC Index Fund,42.24,0.6687,up,1.61,-12.52
BKLN,Invesco Senior Loan ETF,22.76,0.09,up,0.4,-1.86
BLCN,Reality Shares Nasdaq NextGen Economy ETF,22.39,0.3059,up,1.39,-6.16
BLES,Inspire Global Hope ETF,27.6688,0.1038,up,0.38,-3.42
BLHY,Virtus Newfleet Dynamic Credit,23.82,0.04,up,0.17,-4.04
BLOK,Amplify Transformational Data Sharing ETF,17.49,0.2,up,1.16,-12.59
BLV,Vanguard Long-Term Bond ETF,88.83,0.48,up,0.54,-0.56
BMLP,Bank Of Montreal,48.433,0,unch,0,0.96
BND,Vanguard Total Bond Market ETF,79.99,0.18,up,0.23,0.68
BNDC,FlexShares Core Select Bond Fund,24.2949,0.0399,up,0.16,-0.74
BNDX,Vanguard Total International Bond ETF,55.03,0.07,up,0.13,1.85
BNO,"United States Brent Oil Fund, LP ETV",19,0,unch,0,6.92
BOIL,ProShares Ultra Bloomberg Natural Gas,21.66,-0.06,down,0.28,-19.41
BOM,PowerShares DB Gold Fund,8.65,-1.2,down,12.18,39.52
