Symbol,Name,LastSale,NetChange,NetChangeDirection,PercentChange,1YrPercentChange
ECNS,iShares MSCI China Small-Cap ETF,44.7905,0.6205,up,1.4,-16.27
ECON,Columbia Emerging Markets Consumer ETF,22.85,0.34,up,1.51,-18.53
EDBI,Legg Mason Emerging Markets Diversified Core ETF,29.11,0.56,up,1.96,-16.4
EDC,Direxion Emerging Markets Bull 3X Shares,82.07,2.7,up,3.4,-41.34
EDEN,"iShares, Inc.",61.475,0.37,up,0.61,-10.19
EDIV,SPDR S&P Emerging Markets Dividend ETF,32.25,0.32,up,1,-9.9
EDOG,ALPS Emerging Sector Dividend Dogs ETF,22.59,0.34,up,1.53,-14.85
EDOM,WisdomTree Trust,23.972,0.0978,up,0.41,-25.85
EDOW,First Trust Dow 30 Equal Weight ETF,23.5843,0.1628,up,0.7,7.09
EDV,Vanguard Extended Duration Treasury ETF,113.73,0.78,up,0.69,4.53
EDZ,Direxion Emerging Markets Bear 3X Shares,44.04,-1.49,down,3.27,17.5
EEB,Invesco BRIC ETF,36.22,0.5855,up,1.64,-10.86
EEH,AB Svensk Ekportkredit (Swedish Export Credit Corporation),19.815,0,unch,0,-2
EELV,Invesco S&P Emerging Markets Low Volatility ETF,24.51,0.24,up,0.99,-7.47
EEM,iShares MSCI Emerging Index Fund,43.04,0.47,up,1.1,-12.8
EEMA,iShares MSCI Emerging Markets Asia ETF,66.94,0.83,up,1.26,-12.74
EEMD,AAM S&P Emerging Markets High Dividend Value ETF,23.5177,0.2297,up,0.99,-13.42
EEMO,Invesco S&P Emerging Markets Momentum ETF,16.0509,0.1411,up,0.89,-24.31
EEMS,Ishares MSCI Emerging Markets Small Cap Index Fund,44.7,0.31,up,0.7,-16.87
EEMV,"iShares, Inc.",59.31,0.53,up,0.9,-4.9
EEMX,SPDR MSCI Emerging Markets Fuel Reserves Free ETF,62.5256,0.7712,up,1.25,-14.2
EES,WisdomTree U.S. SmallCap Earnings Fund,38.39,0.32,up,0.84,5.81
EET,ProShares Ultra MSCI Emerging Markets,74.495,1.5976,up,2.19,-26.7
EEV,ProShares UltraShort MSCI Emerging Markets,42.2536,-0.9664,down,2.24,13.89
EFA,iShares MSCI EAFE ETF,64.12,0.21,up,0.33,-9.23
EFAD,ProShares Trust,36.49,0.08,up,0.22,-4.23
EFAS,Global X MSCI SuperDividend EAFE ETF,16.1287,-0.0213,down,0.13,-10.82
EFAV,iShares Trust,71.05,0.24,up,0.34,-3.13
EFAX,SPDR MSCI EAFE Fossil Fuel Reserves Free ETF,65.6409,0.1872,up,0.29,-11.31
EFFE,Global X JPMorgan Efficiente Index ETF,24.9,0.12,up,0.48,-6.98
EFG,iShares Trust,75.88,0.33,up,0.44,-6.28
EFNL,"iShares, Inc.",38.63,-0.01,down,0.03,-9.23
EFO,ProShares Ultra MSCI EAFE,36.015,0.2522,up,0.71,-19.27
EFU,ProShares UltraShort MSCI EAFE,25.2458,-0.1848,down,0.73,13.07
EFV,iShares Trust,48.74,0.2,up,0.41,-12.41
EFZ,ProShares Short MSCI EAFE,27.14,-0.07,down,0.26,7.51
EGPT,VanEck Vectors Egypt Index ETF,33.72,0.15,up,0.45,0
EIDO,iShares MSCI Indonesia ETF,26.45,-0.07,down,0.26,-10.07
EIRL,iShares Trust iShares MSCI Ireland ETF,40.88,0,unch,0,-12.59
EIS,iShares Inc iShares MSCI Israel ETF,54.64,0.27,up,0.5,5.12
EKAR,Innovation Shares NextGen Vehicles & Technology ETF,20.9922,0.2271,up,1.09,-19.92
ELD,WisdomTree Emerging Markets Local Debt Fund,34.5,0.16,up,0.47,-12.17
EMAG,VanEck Vectors Emerging Markets Aggregate Bond ETF,20.8839,0.0989,up,0.48,-4.66
EMB,iShares J.P. Morgan USD Emerging Markets Bond ETF,108.77,0.67,up,0.62,-3.24
EMBH,iShares Interest Rate Hedged Emerging Markets Bond ETF,25.255,0.0465,up,0.18,-5.23
EMCB,WisdomTree Emerging Markets Corporate Bond Fund,69.99,-0.1613,down,0.23,-2.7
EMCG,WisdomTree Emerging Markets Consumer Growth Fund,22.01,0.34,up,1.57,-21.49
EMDV,ProShares Trust,57.4091,0.7578,up,1.34,-7.89
EMEM,Virtus Glovista Emerging  Markets ETF,22.5504,0.1812,up,0.81,-17.85
EMFM,Global X MSCI Next Emerging & Frontier ETF,21,0.1,up,0.48,-16.1
EMGF,"iShares, Inc.",43.46,0.54,up,1.26,-16.34
EMHY,"iShares, Inc.",46.72,0.22,up,0.47,-4.77
EMIF,iShares S&P Emerging Markets Infrastructure Index Fund,30.3108,0.4627,up,1.55,-9.9
EMIH,db-X MSCI,23.455,0.14,up,0.6,-8.53
EMLC,VanEck Vectors J.P. Morgan EM Local Currency Bond ETF,34.22,0.12,up,0.35,-12.52
EMLP,First Trust North American Energy Infrastructure Fund,24.17,0.13,up,0.54,4.3
EMMF,WisdomTree Emerging Markets Multifactor Fund,24.0116,0.2132,up,0.9,-3.02
EMQQ,Emerging Markets Internet and Ecommerce ETF (The),31.02,0.93,up,3.09,-27.05
EMSG,Xtrackers MSCI Emerging Markets ESG Leaders Equity ETF,26.09,0.3141,up,1.22,7.78
EMSH,ProShares Trust,75.155,0.015,up,0.02,-1.47
EMTL,SSGA Active Trust,49.095,-0.015,down,0.03,-0.79
EMTY,ProShares Decline of the Retail Store ETF,33.7618,-0.2408,down,0.71,-1.42
EMXC,iShares MSCI Emerging Markets ex China ETF,49.25,0.52,up,1.07,-12.48
ENFR,Alerian Energy Infrastructure ETF,21.36,0.1171,up,0.55,-3.18
ENOR,"iShares, Inc.",25.26,0.215,up,0.86,-6.44
ENTR,ERShares Entrepreneur 30 ETF,16.6304,0.1948,up,1.19,-0.66
ENZL,iShares MSCI New Zealand ETF,49.75,0.3047,up,0.62,2.14
EPHE,iShares MSCI Philippines ETF,34.43,0.31,up,0.91,-7.43
EPI,WisdomTree India Earnings Fund,23.84,0.3,up,1.27,-12.39
EPOL,iShares Trust iShares MSCI Poland ETF,23.28,0.02,up,0.09,-13.56
EPP,iShares MSCI Pacific Ex-Japan Index Fund,45.53,0.39,up,0.86,-5.17
EPRF,Elkhorn ETF Trust,22.945,-0.0005,down,0,-0.8
EPS,WisdomTree U.S. Earnings 500 Fund,31.69,0.16,up,0.51,1.03
EPU,iShares Trust iShares MSCI Peru ETF,38.7066,0.4166,up,1.09,-7.49
EPV,ProShares UltraShort FTSE Europe ETF,34.23,-0.1357,down,0.39,12.43
EQAL,Invesco Russell 1000 Equal Weight ETF,32.14,0.12,up,0.37,4.3
EQL,ALPS Equal Sector Weight ETF,71.32,0.37,up,0.52,3.26
EQLT,Workplace Equality Portfolio ETF,36.7121,0.1787,up,0.49,-1.06
EQRR,ProShares Equities for Rising Rates ETF,43.24,-0.19,down,0.44,-7.6
EQWL,Invesco Russell Top 200 Equal Weight ETF,54.7294,0.2314,up,0.42,2.73
EQWM,Invesco Russell Midcap Equal Weight ETF,49.3868,0.1268,up,0.26,3.36
ERM,EquityCompass Risk Manager ETF,20.235,0.0065,up,0.03,-10.01
ERSX,ERShares Non-US Small Cap ETF,16.685,0.1613,up,0.98,8.83
ERUS,iShares MSCI iShares MSCI Russia ETF,34.42,0.34,up,1,-9.1
ERX,Direxion Energy Bull 3X Shares,22.27,0.19,up,0.86,-16.8
ERY,Direxion Daily Energy Bear 3X Shares,41.84,-0.35,down,0.83,-23.15
ESG,FlexShares STOXX US ESG Impact Index Fund,66.02,0.4774,up,0.73,1.89
ESGD,iShares ESG MSCI EAFE ETF,62.47,0.21,up,0.34,-8.45
ESGE,iShares ESG MSCI EM ETF,34.19,0.48,up,1.42,-12.44
ESGF,Oppenheimer Global ESG Revenue ETF,29.2383,0.1239,up,0.43,-8.11
ESGG,FlexShares STOXX Global ESG Impact Index Fund,93.7875,0.1376,up,0.15,-2.56
ESGL,Oppenheimer Revenue Weighted ETF Trust Oppenheimer ESG Revenue,31.375,0.1844,up,0.59,1.46
ESGN,Columbia Sustainable International Equity Income ETF,25.8902,0.195,up,0.76,-15.42
ESGS,Columbia Sustainable U.S. Equity Income ETF,27.4728,0.0952,up,0.35,-9.49
ESGU,iShares ESG MSCI USA ETF,61.3001,0.4736,up,0.78,1.42
ESGV,Vanguard World Funds,48.43,0.34,up,0.71,-4.75
ESGW,Columbia Sustainable Global Equity Income ETF,26.3198,0.1019,up,0.39,-13.58
ESML,iShares Trust,26.8603,0.2303,up,0.86,3.74
ESPO,VanEck Vectors Video Gaming and eSports ETF,28.83,0.13,up,0.45,-6.51
ETHO,Etho Climate Leadership U.S. ETF,37.0306,0.2896,up,0.79,0
EUDG,WisdomTree Europe Quality Dividend Growth Fund,24.6334,0.1051,up,0.43,-8.5
EUDV,ProShares Trust,39.3761,0.1192,up,0.3,-5.08
EUFL,Direxion Daily European Financials Bull 2X Shares,27.2823,0.135,up,0.5,-44.04
EUFN,iShares MSCI Europe Financials Sector Index Fund,18.18,0.08,up,0.44,-25.33
EUFX,ProShares Short Euro,43.8007,0.0233,up,0.05,13.74
EUM,ProShares Short MSCI Emerging Markets,18.48,-0.21,down,1.12,8.79
EUMV,iShares Edge MSCI Min Vol Europe ETF,24.45,0.1104,up,0.45,-3.3
EUO,ProShares UltraShort Euro,25.01,0.03,up,0.12,23.05
EURL,Direxion Daily FTSE Europe Bull 3x Shares,25.64,0.26,up,1.02,-32.14
EURZ,db-X MSCI,21.2527,0.0583,up,0.28,-14.69
EUSA,iShares MSCI USA Equal Weighted ETF,57.36,0.389,up,0.68,1.72
EUSC,WisdomTree Europe Hedged SmallCap Equity Fund,29.4416,0.0816,up,0.28,-6.35
EUXL,Direxion Daily EURO STOXX 50? Bull 3X Shares,16.395,0.1396,up,0.86,-37.02
EVFTC,Eaton Vance NextShares Trust II,100.03,0,unch,0,0
EVGBC,Eaton Vance NextShares Trust,100.02,0,unch,0,0.04
EVIX,UBS AG,7.8451,-0.0606,down,0.77,-46.45
EVLMC,Eaton Vance NextShares Trust II,99.96,0,unch,0,-0.01
EVSTC,Eaton Vance NextShares Trust,99.98,0,unch,0,0
EVX,VanEck Vectors Environmental Services ETF,96.9109,0.2455,up,0.25,10.01
EWA,iShares MSCI Australia Index Fund,21.29,0.24,up,1.14,-7.92
EWC,iShares MSCI Canada Index Fund,27.9,0.15,up,0.54,-1.46
EWCO,Invesco S&P 500 Equal Weight Communication Services ETF,24.2082,0.2469,up,1.03,-5.03
EWD,iShares Inc iShares MSCI Sweden ETF,30.16,0.32,up,1.07,-13.46
EWEM,Invesco MSCI Emerging Markets Equal Country Weight ETF,32.3281,0.2903,up,0.91,-10.65
EWG,iShares MSCI Germany Index Fund,27.03,0.08,up,0.3,-17.66
EWGS,"iShares, Inc.",53.77,0.0534,up,0.1,-18.11
EWH,iShares MSCI Hong Kong Index Fund,26.02,0.25,up,0.97,1.58
EWI,iShares Inc iShares MSCI Italy ETF,26.6,0.1,up,0.38,-17.16
EWJ,iShares MSCI Japan Index Fund,54.68,0.12,up,0.22,-9.8
EWK,iShares Inc iShares MSCI Belgium ETF,17.73,-0.12,down,0.67,-18.04
EWL,iShares Inc iShares MSCI Switzerland ETF,34.47,0.14,up,0.41,-2.8
EWM,iShares MSCI Malaysia Index Fund,31.12,-0.1,down,0.32,-11.16
EWMC,Invesco S&P MidCap 400 Equal Weight ETF,65.5773,0.5063,up,0.78,2.96
EWN,iShares MSCI Netherlands Index Fund,29.54,0.07,up,0.24,-8.11
EWO,iShares Inc iShares MSCI Austria ETF,19.98,0.02,up,0.1,-20.13
EWP,iShares Inc iShares MSCI Spain ETF,28.69,0.07,up,0.24,-13.17
EWQ,iShares MSCI France Index Fund,29.06,0.13,up,0.45,-8.97
EWRE,Invesco S&P 500 Equal Weight Real Estate ETF,29.4,0.11,up,0.38,17.49
EWS,iShares Inc iShares MSCI Singapore ETF,23.96,-0.05,down,0.21,-10.98
EWSC,Invesco S&P SmallCap 600 Equal Weight ETF,57.1491,0.3691,up,0.65,5.21
EWT,iShares Inc iShares MSCI Taiwan ETF,33.66,0.28,up,0.84,-9.98
EWU,iShares MSCI United Kingdom ETF,32.46,0.1,up,0.31,-7.91
EWUS,"iShares, Inc.",38.28,0.275,up,0.72,-12.65
EWV,ProShares UltraShort MSCI Japan,29.13,-0.51,down,1.72,16.33
EWW,iShares Inc iShares MSCI Mexico ETF,44.65,0.48,up,1.09,-13.17
EWX,SPDR S&P Emerging Markets Small Cap ETF,44.26,0.26,up,0.59,-16.13
EWY,iShares Inc iShares MSCI South Korea ETF,64.48,0.61,up,0.96,-12.21
EWZ,iShares Inc iShares MSCI Brazil ETF,44.15,0.6,up,1.38,-5.02
EWZS,iShares MSCI Brazil Small-Cap ETF,16.05,0.23,up,1.45,-9.5
EXI,iShares Global Industrials ETF,89.2175,0.5344,up,0.6,-6.41
EXIV,UBS AG,30.925,0.875,up,2.91,-7.57
EXT,WisdomTree U.S. Total Earnings Fund,32.2025,0.1625,up,0.51,-0.77
EYLD,Cambria ETF Trust,30.725,-0.09,down,0.29,-14.99
EZA,iShares MSCI South Africa Index Fund,54.32,0.52,up,0.97,-25.59
EZJ,ProShares Ultra MSCI Japan,32.8899,0.23,up,0.7,-26.21
EZM,WisdomTree U.S. MidCap Earnings Fund,40.64,0.25,up,0.62,2.96
EZU,"iShares, Inc.",38.12,0.11,up,0.29,-13.44
FAAR,First Trust Alternative Absolute Return Strategy ETF,26.79,-0.02,down,0.07,-8.09
FAB,First Trust Multi Cap Value AlphaDEX Fund,55.42,0.0601,up,0.11,-0.68
FAD,First Trust Multi Cap Growth AlphaDEX Fund,71.3722,0.9295,up,1.32,3.8
FALN,iShares Fallen Angels USD Bond ETF,25.9901,0.0112,up,0.04,-3.06
FAN,First Trust Global Wind Energy ETF,13.03,0.065,up,0.5,-1.18
FAS,Direxion Financial Bull 3X Shares,62.61,0.42,up,0.68,-10.65
FAUS,First Trust Australia AlphaDex fund,31.075,0.3603,up,1.17,-6.78
FAZ,Direxion Financial Bear 3X Shares,9.49,-0.06,down,0.63,-12.3
FBGX,ETRACS 2X Wells Fargo - BDCI,239.5975,3.9028,up,1.66,-4.7
FBND,Fidelity Total Bond ETF,49.4,0.08,up,0.16,0.74
FBT,First Trust Amex Biotech Index Fund,144.92,2.31,up,1.62,4.53
FBZ,First Trust Brazil AlphaDEX Fund,15.58,0.33,up,2.16,-10.56
FCA,First Trust China AlphaDEX Fund,27.15,0.2792,up,1.04,-16.21
FCAL,First Trust California Municipal High income ETF,50.3367,-0.0733,down,0.15,1.12
FCAN,First Trust Canada AlphaDEX Fund,23.9935,0.3071,up,1.3,-6.73
FCEF,First Trust CEF Income Opportunity ETF,21.23,0.229,up,1.09,-3.18
FCG,First Trust Natural Gas ETF,17.01,0.04,up,0.24,-15.87
FCOM,Fidelity MSCI Communication Services Index ETF,31.76,0.27,up,0.86,6.82
FCOR,Fidelity Corporate Bond ETF,49.11,0.1,up,0.2,-0.53
FCTR,First Trust Exchange-Traded Fund,20.3826,0.1608,up,0.8,-0.54
FCVT,First Trust SSI Strategic Convertible Securities ETF,30.26,0.24,up,0.8,3.66
FDD,First Trust Dow Jones STOXX Select Dividend 30 Index Fund,12.68,0.03,up,0.24,-9.58
FDHY,Fidelity High Yield Factor ETF,50.413,0.0464,up,0.09,0.2
FDIS,Fidelity MSCI Consumer Discretionary Index ETF,42.97,0.2701,up,0.63,4.1
FDIV,First Trust Strategic Income ETF,49.5688,0.189,up,0.38,-0.7
FDL,First Trust Morningstar ETF,29.67,0.24,up,0.82,2.9
FDLO,Fidelity Low Volatility Factor ETF,33.45,0.23,up,0.69,8.49
FDM,First Trust DJ Select MicroCap ETF,47.84,0.35,up,0.74,1.45
FDMO,Fidelity Momentum Factor ETF,33.43,0.25,up,0.75,3.69
FDN,First Trust DJ Internet Index Fund,137.37,1.59,up,1.17,11.54
FDNI,First Trust Dow Jones International Internet ETF,20.6972,0.2072,up,1.01,1.64
FDRR,Fidelity Dividend ETF for Rising Rates,31.54,0.17,up,0.54,1.72
FDT,First Trust Developed Markets Ex-US AlphaDEX Fund,54.55,0.3747,up,0.69,-14.28
FDTS,First Trust Developed Markets ex-US Small Cap AlphaDEX Fund,37.27,0.18,up,0.49,-17.71
FDVV,Fidelity High Dividend ETF,29.85,0.08,up,0.27,3.37
FEM,First Trust Emerging Markets AlphaDEX Fund,25.45,0.26,up,1.03,-14.64
FEMB,First Trust Emerging Markets Local Currency Bond ETF,38.26,0.09,up,0.24,-11.56
FEMS,First Trust Emerging Markets Small Cap AlphaDEX Fund,35.83,0.34,up,0.96,-20.78
FENY,Fidelity MSCI Energy Index ETF,17.98,0.06,up,0.33,-2.66
FEP,First Trust Europe AlphaDEX Fund,34.49,0.18,up,0.52,-14.07
FEU,SPDR DJ STOXX 50 Etf,32.43,0.1,up,0.31,-8.62
FEUL,Credit Suisse AG,82.86,0.46,up,0.56,-18.61
FEUZ,First Trust Eurozone AlphaDEX ETF,37.5077,0.0026,up,0.01,-16.49
FEX,First Trust Large Cap Core AlphaDEX Fund,59.51,0.28,up,0.47,-0.02
FEZ,SPDR DJ Euro STOXX 50 Etf,36.06,0.14,up,0.39,-11.85
FFEU,Barclays PLC,85.979,0.2402,up,0.28,-10.07
FFHG,Northern Lights Fund Trust IV,27.4441,0.2074,up,0.76,-2.16
FFIU,Fieldstone UVA Unconstrained Medium-Term Fixed Income ETF,24.575,0.0388,up,0.16,0.27
FFR,First Trust FTSE EPRA/NAREIT Global Real Estate Index Fund,46.755,0.225,up,0.48,9.59
FFSG,Northern Lights Fund Trust IV,25.8752,0.1352,up,0.53,-0.1
FFTG,Northern Lights Fund Trust IV,24.0547,0.0696,up,0.29,-5.79
FFTI,Northern Lights Fund Trust IV,23.6598,0.0998,up,0.42,-2.93
FFTY,Innovator IBD 50 ETF,33.16,0.48,up,1.47,-1.63
FGD,First Trust DJ Global Select Dividend,23.72,0.13,up,0.55,-9.72
FGM,First Trust Germany AlphaDEX Fund,41.4,0.0088,up,0.02,-18.91
FHK,First Trust Hong Kong AlphaDEX Fund,37.14,0,unch,0,-12.53
FHLC,Fidelity MSCI Health Care Index ETF,44.76,0.41,up,0.92,8.33
FIBR,iShares U.S. ETF Trust,97.9019,0.162,up,0.17,0.02
FID,First Trust S&P International Dividend Aristocrats ETF,16.91,0.071,up,0.42,-9.51
FIDI,Fidelity International High Dividend ETF,21.17,0.03,up,0.14,-10.88
FIDU,Fidelity MSCI Industrials Index ETF,38.88,0.26,up,0.67,-0.69
FIEE,UBS AG,145.3005,0.5852,up,0.4,-16.11
FIEG,Deutsche Bank AG,167.57,2.52,up,1.53,2.8
FIHD,UBS AG,166.5,2.1632,up,1.32,-1.87
FILL,iShares MSCI Global Energy Producers Fund,20.8073,0.0973,up,0.47,0.24
FINU,ProShares UltraPro Financial Select Sector,76.79,-0.48,down,0.62,-32.08
FINX,Global X FinTech ETF,26.67,0.59,up,2.26,11.07
FINZ,ProShares UltraPro Short Financial Select Sector,7.57,0.01,up,0.13,9.41
FIVA,Fidelity International Value Factor ETF,21.803,0.118,up,0.54,-9.95
FIW,First Trust Water ETF,51.48,0.4514,up,0.88,7.3
FIXD,First Trust TCW Opportunistic Fixed Income ETF,49.85,0.18,up,0.36,0.83
FIYY,Barclays PLC,99.7349,1.0474,up,1.06,-2.41
FJP,First Trust Japan AlphaDEX Fund,50,0.13,up,0.26,-15.67
FKO,First Trust South Korea AlphaDEX Fund,23.386,0,unch,0,-20.66
FKU,First Trust United Kingdom AlphaDEX Fund,36.7071,0.1178,up,0.32,-10.86
FLAG,Exchange Traded Concepts Trust FLAG-Forensic Accounting Long-S,40.6025,-0.1017,down,0.25,-3.85
FLAT,Barclays PLC,64.2,0,unch,0,2.25
FLAU,Franklin FTSE Australia ETF,24.49,0.2603,up,1.07,-5.46
FLAX,Franklin FTSE Asia ex Japan ETF,21.6109,0.2409,up,1.13,-11.55
FLBL,Franklin Templeton ETF Trust,25.14,0.105,up,0.42,-0.65
FLBR,Franklin FTSE Brazil ETF,27.3953,0.39,up,1.44,-6.64
FLCA,Franklin FTSE Canada ETF,24.375,0.145,up,0.6,0.02
FLCH,Franklin FTSE China ETF,23.6501,0.4451,up,1.92,-15.59
FLCO,Franklin Liberty Investment Grade Corporate ETF,23.705,0.07,up,0.3,-1.23
FLDR,Fidelity Merrimack Street Trust,50.23,0.01,up,0.02,0.42
FLEE,Franklin FTSE Europe ETF,22.8786,0.0691,up,0.3,-10.65
FLEH,Franklin FTSE Europe Hedged ETF,22.278,0.0638,up,0.29,-6.82
FLEU,Barclays ETN  FI Enhanced Europe 50 ETN Series B,125.8412,0.593,up,0.47,-18.68
FLFR,Franklin FTSE France ETF,23.5683,0.0999,up,0.43,-9.94
FLGB,Franklin FTSE United Kingdom ETF,23.87,0.06,up,0.25,-8.18
FLGE,Credit Suisse AG,240.5545,4.0272,up,1.7,-3.31
FLGR,Franklin FTSE Germany ETF,20.815,0.0606,up,0.29,-17.63
FLHK,Franklin FTSE Hong Kong ETF,26.7009,0.2729,up,1.03,-1.38
FLHY,Franklin Templeton ETF Trust,25.305,0.0155,up,0.06,0.56
FLIA,Franklin Templeton ETF Trust,24.58,0.065,up,0.27,-2.64
FLIN,Franklin FTSE India ETF,21.4904,0.1846,up,0.87,-9.59
FLIO,Franklin Liberty International Opportunities ETF,26.8102,0.157,up,0.59,-7.63
FLIY,Franklin FTSE Italy ETF,22.175,0.075,up,0.34,-16.13
FLJH,Franklin FTSE Japan Hedged ETF,23.1031,0.0529,up,0.23,-9.57
FLJP,Franklin FTSE Japan ETF,24.2527,0.0615,up,0.25,-10.37
FLKR,Franklin FTSE South Korea ETF,22.3984,0.1936,up,0.87,-14.13
FLLA,Franklin FTSE Latin America ETF,27.8319,0.3853,up,1.4,7.99
FLLV,Franklin Liberty U.S. Low Volatility ETF,32.8568,0.226,up,0.69,7.69
FLM,First Trust Global Engineering and Construction ETF,50.64,0.4948,up,0.99,-14.76
FLMB,Franklin Templeton ETF Trust Franklin Liberty Municipal Bond E,24.795,0.035,up,0.14,1.81
FLMI,Franklin Templeton ETF Trust Franklin Liberty Intermediate Mun,24.65,0.01,up,0.04,0.61
FLMX,Franklin FTSE Mexico ETF,22.6235,0.2431,up,1.09,-14.74
FLN,First Trust Latin America AlphaDEX Fund,21.0934,0.1934,up,0.93,-6.11
FLOT,iShares Trust,50.775,0.015,up,0.03,0
FLQD,Franklin LibertyQ Global Dividend ETF,28.0949,0.1752,up,0.63,-3.16
FLQE,Franklin LibertyQ Emerging Markets ETF,30.16,0.3703,up,1.24,-12.15
FLQG,Franklin LibertyQ Global Equity ETF,30.5848,0.2564,up,0.85,-1.43
FLQH,Franklin LibertyQ International Equity Hedged ETF,24.45,0.12,up,0.49,-0.41
FLQL,Franklin Templeton ETF Trust,30.9695,0.255,up,0.83,5.88
FLQM,Franklin Templeton ETF Trust,29.9348,0.1964,up,0.66,5.2
FLQS,Franklin Templeton ETF Trust,28.5117,0.0897,up,0.32,7
FLRN,SPDR Bloomberg Barclays Investment Grade Floating Rate ETF,30.63,0.02,up,0.07,0
FLRT,AdvisorShares Pacific Asset Enhanced Floating Rate ETF,48.6468,0.3618,up,0.75,-2.34
FLRU,Franklin FTSE Russia ETF,23.2508,0.2089,up,0.91,-7.91
FLSA,Franklin FTSE Saudi Arabia ETF,27.2466,0.1284,up,0.47,13.95
FLSW,Franklin FTSE Switzerland ETF,23.2259,0.0676,up,0.29,-4.51
FLTB,Fidelity Limited Term Bond ETF,49.755,0.055,up,0.11,0.28
FLTR,VanEck Vectors Investment Grade Floating Rate ETF,25.06,0.01,up,0.04,-1.18
FLTW,Franklin FTSE Taiwan ETF,24.0997,0.1989,up,0.83,-8.29
FLZA,Franklin FTSE South Africa ETF,27.68,0.29,up,1.06,13.56
FM,iShares MSCI Frontier 100 Fund,28.91,0.16,up,0.56,0
FMAT,Fidelity MSCI Materials Index ETF,32,0.12,up,0.38,-8.18
FMB,First Trust Managed Municipal ETF,53.03,0.0429,up,0.08,1.14
FMF,First Trust Morningstar Managed Futures Strategy Fund,44.72,0.015,up,0.03,-5.47
FMHI,First Trust Municipal High Income ETF,50.5,-0.101,down,0.2,1.96
FMK,First Trust Mega Cap AlphaDEX Fund,34.72,-0.27,down,0.77,0.72
FNCL,Fidelity MSCI Financials Index ETF,38.86,-0.04,down,0.1,-7.69
FNDA,Schwab Fundamental U.S. Small Company Index ETF,38.58,0.29,up,0.76,2.6
FNDB,Schwab Fundamental U.S. Broad Market Index ETF,37.78,0.1706,up,0.45,1.87
FNDC,Schwab Fundamental International Small Company Index ETF,31.22,0.14,up,0.45,-13.76
FNDE,Schwab Fundamental Emerging Markets Large Company Index ETF,28.44,0.27,up,0.96,-9.71
FNDF,Schwab Fundamental International Large Company Index ETF,27.49,0.09,up,0.33,-9.45
FNDX,Schwab Fundamental U.S. Large Company Index ETF,37.99,0.2,up,0.53,1.94
FNG,AdvisorShares New Tech and Media ETF,16.16,0.26,up,1.64,-28.99
FNGD,Bank Of Montreal,25.19,-0.85,down,3.26,-33.57
FNGO,Bank Of Montreal,39.0043,0.9469,up,2.49,-25.87
FNGU,Bank Of Montreal,38.5,1.41,up,3.8,-37.38
FNGZ,Bank Of Montreal,49.535,-1.2612,down,2.48,3.32
FNI,First Trust Chindia ETF,34.88,0.806,up,2.37,-17.04
FNK,First Trust Mid Cap Value AlphaDEX Fund,35.9101,0.32,up,0.9,1.57
FNX,First Trust Mid Cap Core AlphaDEX Fund,68.58,0.78,up,1.15,2.87
FNY,First Trust Mid Cap Growth AlphaDEX Fund,43.345,0.655,up,1.53,5.25
FOANC,Gabelli NextShares Trust,99.96,0,unch,0,0
FONE,First Trust NASDAQ Smartphone Index Fund,48.282,0.522,up,1.09,-9.75
FPA,First Trust Asia Pacific Ex-Japan AlphaDEX Fund,31.25,0.26,up,0.84,-14.72
FPE,First Trust Preferred Securities and Income ETF ETF,18.82,0.04,up,0.21,-4.33
FPEI,First Trust Institutional Preferred Securities and Income ETF,18.76,0.01,up,0.05,-5.54
FPX,First Trust US Equity Opportunities ETF,72.26,0.06,up,0.08,2.64
FPXE,First Trust IPOX Europe Equity Opportunities ETF,18.61,0.05,up,0.27,-4.77
FPXI,First Trust International Equity Opportunities ETF,34.4973,0.3209,up,0.94,-8.68
FQAL,Fidelity Quality Factor ETF,33.3924,0.1124,up,0.34,2.56
FRAK,VanEck Vectors Unconventional Oil & Gas ETF,12.5412,0.1312,up,1.06,-12.54
FREL,Fidelity MSCI Real Estate Index ETF,25.52,0.14,up,0.55,14.32
FRI,First Trust S&P REIT Index Fund,24.58,0.15,up,0.61,19.05
FRLG,"Goldman Sachs Group, Inc. (The)",104.34,2.0263,up,1.98,6.6
FRN,Invesco Frontier Markets ETF,13.5,0.07,up,0.52,-14.73
FSMB,First Trust Short Duration Managed Municipal ETF,20.2104,0.0093,up,0.05,0.55
FSTA,Fidelity MSCI COnsumer Staples Index ETF,32.9,-0.09,down,0.27,2.04
FSZ,First Trust Switzerland AlphaDEX Fund,47.457,0.427,up,0.91,-12.78
FTA,First Trust Large Cap Value AlphaDEX Fund,52.42,0.03,up,0.06,-2.51
FTAG,First Trust Indxx Global Agriculture ETF,23.8546,-0.0054,down,0.02,-13.68
FTC,First Trust Large Cap Growth AlphaDEX Fund,65.77,0.5374,up,0.82,1.7
FTCS,First Trust Capital Strength ETF,53.8,0.36,up,0.67,3.09
FTEC,Fidelity MSCI Information Technology Index ETF,56.97,0.72,up,1.28,6.59
FTGC,First Trust Global Tactical Commodity Strategy Fund,19,0.07,up,0.37,-8.9
FTHI,First Trust BuyWrite Income ETF,21.7908,0.0956,up,0.44,-3.71
FTLB,First Trust Hedged BuyWrite Income ETF,21.6859,0.0634,up,0.29,-3.69
FTLS,First Trust Long/Short Equity,38.9,0.11,up,0.28,-2.19
FTRI,First Trust Indxx Global Natural Resources Income ETF,12.411,0.0411,up,0.33,0
FTSD,Franklin Liberty Short Duration U.S. Government ETF,94.62,0.07,up,0.07,-0.87
FTSL,First Trust Senior Loan Fund ETF,47.45,0.15,up,0.32,-1.7
FTSM,First Trust Enhanced Short Maturity ETF,60.03,0.01,up,0.02,0.05
FTVA,ETF Series Solutions,26.8,0.27,up,1.02,-3.84
FTXD,First Trust Nasdaq Retail ETF,22.31,0,unch,0,0.95
FTXG,First Trust Nasdaq Food & Beverage ETF,18.865,-0.2598,down,1.36,-7.07
FTXH,First Trust Nasdaq Pharmaceuticals ETF,21.14,0.2556,up,1.22,-5.61
FTXL,First Trust Nasdaq Semiconductor ETF,31.62,0.27,up,0.86,-2.12
FTXN,First Trust Nasdaq Oil & Gas ETF,18.84,0.04,up,0.21,-3.09
FTXO,First Trust Nasdaq Bank ETF,26.58,0,unch,0,-16.18
FTXR,First Trust Nasdaq Transportation ETF,24.5,0,unch,0,-4.11
FUD,ETRACS 2X Wells Fargo - BDCI,16.79,0.055,up,0.33,-8.38
FUE,AB Svensk Ekportkredit (Swedish Export Credit Corporation),6.555,0.005,up,0.08,-7.62
FUMB,First Trust Ultra Short Duration Municipal ETF,20.04,0.0029,up,0.01,-0.2
FUT,ProShares Trust,39.7823,0.123,up,0.31,0.41
FUTY,Fidelity MSCI Utilities Index ETF,37.63,0.22,up,0.59,17.35
FV,First Trust Dorsey Wright Focus 5 ETF,29.64,0.38,up,1.3,0
FVAL,Fidelity Value Factor ETF,33.42,0.27,up,0.81,0.58
FVC,First Trust Dorsey Wright Dynamic Focus 5 ETF,26.53,0.1403,up,0.53,-3.19
FVD,First Trust VL Dividend,32.18,0.07,up,0.22,7.25
FVL,First Trust Value Line 100 Fund,20.7974,0.0983,up,0.47,-13.89
FWDB,Madrona Global Bond ETF,25.155,0.045,up,0.18,-2.05
FWDD,Madrona Domestic ETF,52.6619,0.3215,up,0.61,-3.93
FWDI,Madrona International ETF,27.505,0.35,up,1.29,-15.63
FXA,Invesco CurrencyShares Australian Dollar Trust,71.35,0.32,up,0.45,-9.06
FXB,Invesco CurrencyShares British Pound Sterling Trust,126.57,0.12,up,0.09,-6.5
FXC,Invesco CurrencyShares Canadian Dollar Trust,75.07,0.46,up,0.62,-4.03
FXCH,Invesco CurrencyShares Chinese Renminbi Trust,72.8771,0.1309,up,0.18,-6.31
FXD,First Trust Cons. Discret. AlphaDEX,42.14,0.23,up,0.55,-1.46
FXE,Invesco CurrencyShares Euro Currency Trust,108.18,-0.05,down,0.05,-8.51
FXF,Invesco CurrencyShares Swiss Franc Trust,93.06,0.0759,up,0.08,-7.34
FXG,First Trust Cons. Staples AlphaDEX,44.68,-1.02,down,2.23,-3.89
FXH,First Trust Health Care AlphaDEX,76.66,0.69,up,0.91,6.22
FXI,iShares China Large-Cap ETF,44.14,0.74,up,1.71,-11.57
FXL,First Trust Technology AlphaDEX,63.95,0.92,up,1.46,14.87
FXN,First Trust Energy AlphaDEX Fund,13.08,0.1,up,0.77,-3.92
FXO,First Trust Financials AlphaDEX,31.16,0.19,up,0.61,-1.09
FXP,ProShares Ultrashort FTSE China 50,59.57,-1.92,down,3.12,5.58
FXR,First Trust Industrials AlphaDEX,40.47,0.18,up,0.45,-0.02
FXS,Invesco CurrencyShares Swedish Krona Trust,99.858,0.1977,up,0.2,-15.13
FXSG,Invesco CurrencyShares Singapore Dollar Trust ETF,72.6372,0.0656,up,0.09,-3.24
FXU,First Trust Utilities AlphaDEX Fund,28.53,-0.06,down,0.21,17.65
FXY,Invesco CurrencyShares Japanese Yen Trust,86.24,0.05,up,0.06,-3.2
FXZ,First Trust Materials AlphaDEX Fund,39.38,0.24,up,0.61,-10.08
FYC,First Trust Small Cap Growth AlphaDEX Fund,46.96,0.49,up,1.05,7.57
FYLD,Cambria ETF Trust,23.7048,0.1398,up,0.59,-11.06
FYT,First Trust Small Cap Value AlphaDEX Fund,36.71,-0.0032,down,0.01,2.63
FYX,First Trust Small Cap Core AlphaDEX Fund,63.98,0.42,up,0.66,5.3
GAA,Cambria ETF Trust,26.54,0.12,up,0.45,-3.82
GAL,SPDR SSgA Global Allocation ETF,37.4428,0.1686,up,0.45,-3.12
GAMR,ETFMG Video Game Tech ETF,42.22,0.14,up,0.33,-15.31
GARD,Reality Shares ETF Trust,24.1384,0.0876,up,0.36,-6.89
